search_term,ol_key,title,author,first_publish_year,publisher,language,subject,isbn,cover_i
graphic memoir,/works/OL41897312W,Komik-Komik Sama-Sama,Rod R. Driver,2024.0,,eng,,,
graphic memoir,/works/OL41903513W,Jobs and Other Bad Decisions,B. Erin Cole,2024.0,,eng,,,
graphic memoir,/works/OL25633196W,Marc Márquez,"Isidro Sanchez, Belén Ortega",2017.0,,eng,,,
graphic memoir,/works/OL19729061W,Morton,David Collier,2017.0,,eng,,,12021699.0
graphic memoir,/works/OL22634959W,Volshebnyĭ fonarʹ,Vitaliĭ Aronzon,2011.0,,rus,,,
graphic memoir,/works/OL21195463W,Basquiat,Paolo Parisi,2019.0,,eng,,,13136246.0
graphic memoir,/works/OL19047027W,Nanda Devi,"Eric Earle Shipton, H. W. Tilman, Eric Shipton",2000.0,,eng,,,2102978.0
graphic memoir,/works/OL8840400W,Sisters,"Aileen Gallaher, Samme Gallaher",2004.0,,eng,,,740118.0
graphic memoir,/works/OL20035121W,What is obscenity?,Rokudenashiko,2016.0,,eng,,,
graphic memoir,/works/OL20040412W,Mary Astor's Purple diary,Edward Sorel,2016.0,,eng,,,13089209.0
graphic memoir,/works/OL21192617W,Darwin,"Fabien Grolleau, Jeremie Royer",2019.0,,eng,,,
graphic memoir,/works/OL21194478W,Fortune and Glory - Hollywood,Brian Michael Bendis,2019.0,,eng,,,
graphic memoir,/works/OL26395097W,Novelas gráficas del rock,"Jim McCarthy, Brian Williamson",2021.0,,,,,12342625.0
graphic memoir,/works/OL38646531W,Such a Lovely Little War,"Marcelino Truong, David Homel",2016.0,,eng,,,
graphic memoir,/works/OL7799385W,Meeting God in the breakdown lane,Al Anderson,1995.0,,eng,,,14561862.0
graphic memoir,/works/OL19712302W,Josephine Baker,José-Louis Bocquet,2017.0,,eng,,,
graphic memoir,/works/OL21183362W,Drawn to Berlin,"Ali Fitzgerald, Ali Fitzgerald",2018.0,,eng,,,
graphic memoir,/works/OL21605266W,Marx Freud & Einstein,"Corinne Maier, Anne Simon",2017.0,,eng,,,15138064.0
graphic memoir,/works/OL25698690W,Much Ado about Shakespeare,Donovan Bixley,2016.0,,eng,,,
graphic memoir,/works/OL20038296W,Einstein,Corinne Maier,2016.0,,eng,,,
graphic memoir,/works/OL23409624W,Biography of Dil Jan Khan,Akbar Jan Marwat,2013.0,,eng,,,
graphic memoir,/works/OL27798717W,Bridge,"Peter J. Tomasi, Sara Duvall",2018.0,,eng,,,
graphic memoir,/works/OL25056887W,Wind of Things,"Frédéric Pajak, Donald Nicholson-Smith",2019.0,,eng,,,
graphic memoir,/works/OL27465986W,Man of Peace,"William Meyers, Robert A. F. Thurman, Michael G. Burbank",2020.0,,eng,,,
graphic memoir,/works/OL19764578W,Norths,Alison McCreesh,2018.0,,eng,,,
graphic memoir,/works/OL5844191W,Les figures réciproques en statique graphique,Luigi Cremona,1885.0,,fre,,,9667636.0
graphic memoir,/works/OL21317673W,Wonderful World of Perfecto,"Paul Oakenfold, Chris Hunt, Tyler Boss, Ian McGinty, Koren Shadmi",2017.0,,eng,,,
graphic memoir,/works/OL17771953W,"Papers, literary, scientific, &c., by the late Fleeming Jenkin ...",Fleeming Jenkin,1887.0,,eng,,,6350050.0
graphic memoir,/works/OL20057413W,The Beatles,Jason Quinn,2016.0,,eng,,,13085277.0
graphic memoir,/works/OL21137816W,"Take That, Adolf!","Mark Fertig, Jack Kirby, Will Eisner, Alex Schomburg",2017.0,,eng,,,15130968.0
graphic memoir,/works/OL20036642W,Our lady of birth control,Sabrina Jones,2016.0,,eng,,,13060687.0
graphic memoir,/works/OL19738502W,The bridge,Peter Tomasi,2018.0,,eng,,,
graphic memoir,/works/OL19975816W,Gandhi,Jason Quinn,2013.0,,eng,,,
graphic memoir,/works/OL20042895W,The case of Alan Turing,Eric Liberge,2016.0,,eng,,,
graphic memoir,/works/OL19749282W,A minyen Yidn (un andere zakhn) =,Max B. Perlson,2017.0,,eng,,,
graphic memoir,/works/OL20055075W,Man of peace,William Meyers,2016.0,,eng,,,12377863.0
graphic memoir,/works/OL43583862W,Ostnaté vzpomínky,"Karel Valter, Máša Valterová",2015.0,,cze,,,
graphic memoir,/works/OL21299540W,Dreams in Thin Air,"Michael Nybrandt, Thomas Mikkelsen, His Holiness Tenzin Gyatso the XIV Dalai Lama",2017.0,,eng,,,14460610.0
literary comics,/works/OL53994W,The Prince and the Pauper,Mark Twain,1881.0,,"ita, spa, fre, rus, dan",,,8221267.0
literary comics,/works/OL8662242W,David Copperfield,Charles Dickens,1800.0,,"chi, und, rus, yid, heb",,,1048892.0
literary comics,/works/OL503666W,Don Quijote de la Mancha,Miguel de Cervantes Saavedra,1600.0,,"gre, glg, dan, ori, rus",,,14428305.0
literary comics,/works/OL53908W,Adventures of Huckleberry Finn,Mark Twain,1876.0,,"fin, chi, rus, hin, jpn",,,8157718.0
literary comics,/works/OL151406W,Through the Looking-Glass,Lewis Carroll,1865.0,,"gre, chi, rus, wel, heb",,,11272464.0
literary comics,/works/OL151411W,Alice's Adventures in Wonderland / Through the Looking Glass,Lewis Carroll,1889.0,,"chi, rus, und, fre, ita",,,8595966.0
literary comics,/works/OL258850W,Othello,William Shakespeare,1622.0,,"rum, pan, mac, ita, yid",,,7165018.0
literary comics,/works/OL1833989W,Le fantôme de l'opéra,Gaston Leroux,1911.0,,"ita, spa, fre, chi, eng",,,8245407.0
literary comics,/works/OL138052W,Alice's Adventures in Wonderland,Lewis Carroll,1865.0,,"fry, gre, fin, hun, chi",,,10527843.0
literary comics,/works/OL23204W,Of Mice and Men,John Steinbeck,1937.0,,"chi, eng, ger, jpn, dut",,,14319003.0
literary comics,/works/OL1209288W,Im Westen nichts Neues,Erich Maria Remarque,1928.0,,"ice, gre, chi, rus, vie",,,12706822.0
literary comics,/works/OL76524W,The Thirty-Nine Steps,John Buchan,1915.0,,"pol, und, heb, fre, eng",,,93020.0
literary comics,/works/OL176092W,The Moonstone,Wilkie Collins,1800.0,,"mon, cze, chi, rus, ara",,,8237041.0
literary comics,/works/OL36287W,Le Comte de Monte Cristo,Alexandre Dumas,1830.0,,"arm, tgl, dan, jrb, chi",,,14566393.0
literary comics,/works/OL61981W,Ἰλιάς,Όμηρος,1505.0,,"tam, gre, chi, und, rus",,,7083790.0
literary comics,/works/OL1348798W,"Henry IV, Part 1",William Shakespeare,1598.0,,"slo, swe, hun, rus, und",,,116833.0
literary comics,/works/OL19842W,Captains Courageous,Rudyard Kipling,1896.0,,"ita, spa, fre, eng, ger",,,12819857.0
literary comics,/works/OL45623W,The History of Tom Jones,Henry Fielding,1749.0,,"chi, rus, vie, fre, eng",,,12968864.0
literary comics,/works/OL79362W,The Rape of the Lock,Alexander Pope,1714.0,,"eng, fre, ger, ita",,,8234360.0
literary comics,/works/OL41059W,The Tell-Tale Heart,Edgar Allan Poe,1958.0,,"eng, fre, ger, spa",,,11851436.0
literary comics,/works/OL276395W,Washington Square,Henry James,1880.0,,"ita, spa, pol, fre, cat",,,8243278.0
literary comics,/works/OL578528W,Joan Miró,"Joan Miró, Stephan Von Wiese, Sylvia Martin, Victoria Combalia Dexeus, Joaquim Gomis",1937.0,,"ita, spa, fre, cat, eng",,,2241129.0
literary comics,/works/OL2004807W,Tom's Midnight Garden,Philippa Pearce,1958.0,,"cat, und, heb, chi, eng",,,3077039.0
literary comics,/works/OL362685W,Troilus and Cressida,William Shakespeare,1609.0,,"cat, mul, und, pol, heb",,,8789523.0
literary comics,/works/OL2897797W,V for Vendetta,"Alan Moore, David Lloyd",1988.0,,"ita, fre, chi, eng, por",,,12293384.0
literary comics,/works/OL26030510W,Romeo & Juliet,William Shakespeare,1939.0,,"ita, spa, fre, eng, ger",,,12065571.0
literary comics,/works/OL495872W,The song of Hiawatha,"Henry Wadsworth Longfellow, Jeff Ulmer, Alex A. Blum",1855.0,,"spa, fre, rus, lat, eng",,,8237825.0
literary comics,/works/OL1152115W,Beggar's opera,John Gay,1728.0,,eng,,,8237929.0
literary comics,/works/OL245401W,The Prisoner of Zenda,"Anthony Hope, Gary Hoppenstand, Diane Mowat, Alan Marks, Francesc Ràfols, Andrew Pugsley, Summer M. Hogan, Summer Hogan, Smidgen Press, Charles Dana Gibson, Daniel Lanza Barba, Javier Fornell Fernandez, Stephen Colbourn, Katy Jackson, James Wilby, Robinson, M.",1800.0,,"spa, fre, eng, ara, heb",,,105814.0
literary comics,/works/OL21208765W,"Boy, the Mole, the Fox and the Horse",Charlie Mackesy,2019.0,,"eng, gla, spa, wel, por",,,10523448.0
literary comics,/works/OL16923612W,Scarlet Letter,Nathaniel Hawthorne,1986.0,,eng,,,10228992.0
literary comics,/works/OL258893W,Henry V [adaptation],William Shakespeare,1805.0,,"ger, eng, chi",,,3049999.0
literary comics,/works/OL2694991W,Romeo and Juliet (adaptation),"William Shakespeare, John McDonald",1748.0,,"eng, ger, fre, tur",,,2326889.0
literary comics,/works/OL20583W,A tale of a tub,Jonathan Swift,1704.0,,"ger, eng, fre",,,5701622.0
literary comics,/works/OL151073W,Tintin au Congo,Hergé,1930.0,,"ita, spa, fre, chi, eng",,,2378896.0
literary comics,/works/OL626383W,Sunshine sketches of a little town,Stephen Leacock,1900.0,,"chi, eng, fre",,,2099170.0
literary comics,/works/OL18354276W,Arguing comics,"Jeet Heer, Kent Worcester",2004.0,,eng,,,834153.0
literary comics,/works/OL32147984W,Comic valentine writer,Literary lady,1843.0,,eng,,,
literary comics,/works/OL1647068W,Soldados de Salamina,"Javier Cercas, Elisabeth Beyer, Aleksandar Grujicic, José Pablo García",2001.0,,"por, heb, fre, eng, spa",,,12856695.0
literary comics,/works/OL20732919W,"American Comics, Literary Theory, and Religion",A. Lewis,2014.0,,eng,,,9424367.0
literary comics,/works/OL28792326W,"American Comics, Literary Theory, and Religion",A. David Lewis,2014.0,,eng,,,
literary comics,/works/OL14915565W,The Comedies (All's Well That Ends Well / As You Like It / Comedy of Errors / Love's Labour's Lost / Measure for Measure / Merchant of Venice / Merry Wives of Windsor / Midsummer Night's Dream / Much Ado About Nothing / Taming of the Shrew / Tempest / Twelfth Night / Two Gentlemen of Verona / Winter's Tale),William Shakespeare,1847.0,,"fre, und, eng, ger",,,8774847.0
literary comics,/works/OL34224268W,Comics and Novelization,Benoît Glaude,2023.0,,eng,,,
literary comics,/works/OL17030873W,"The comic offering, or, Ladies' melange of literary mirth",Louisa Henrietta Sheridan,1833.0,,eng,,,9522378.0
literary comics,/works/OL3286045W,Poetry Comics,Dave Morice,1982.0,,eng,,,705835.0
literary comics,/works/OL21126523M,The comic offering,,1834.0,,eng,,,
literary comics,/works/OL40412062W,Gang World #5,"Kari Therrian, Literary Enterprises",2015.0,,eng,,,
literary comics,/works/OL40147246W,Gang World #6,"Kari Therrian, Literary Enterprises",2015.0,,eng,,,
literary comics,/works/OL3786350W,The Irish comic tradition,Vivian Mercier,1962.0,,eng,,,9311611.0
literary comics,/works/OL258990W,Works (46),William Shakespeare,1905.0,,"und, eng",,,9071126.0
literary comics,/works/OL20813470W,Flamer,Mike Curato,2020.0,,eng,,,14611566.0
literary comics,/works/OL13158549W,"The Comic Offering, Or, Ladies' Melange of Literary Mirth",Louisa Henrietta Sheridan,1832.0,,,,,9914184.0
literary comics,/works/OL13158550W,"The Comic Offering; Or Ladies' Melange of Literary Mirth, for MDCCCXXXI ..",Louisa Henrietta Sheridan,1835.0,,,,,9878673.0
literary comics,/works/OL21057373M,The Comic offering,,1832.0,,eng,,,
literary comics,/works/OL33990909W,Literary laughter,Elliot Engel,1991.0,,eng,,,15006701.0
literary comics,/works/OL362176W,The tragedy of Macbeth,William Shakespeare,1790.0,,"ita, eng, fre, spa, dut",,,12387085.0
literary comics,/works/OL20004033W,Asian comics,John A. Lent,2015.0,,eng,,,11459998.0
literary comics,/works/OL10273313W,Literary Laughter Being a Treasury of Comic Writings by Chaucer Shaker,E. Engel,1991.0,,,,,
literary comics,/works/OL20262506M,"The Comic offering; or, Ladies' melange of literary mirth for MDCCCXXXV",,1835.0,,eng,,,
literary comics,/works/OL19194974W,Gay comics,Robert Triptow,1989.0,,eng,,,11480724.0
literary comics,/works/OL8143353W,The Ramayana,"Ramesh Menon, Vālmīki, C. Rajagopalachari, Romesh Chunder Dutt, Manmatha Nath Dutt, Anant Pai, S.K. Ratcliffe",1829.0,,"lat, urd, ben, ita, hin",,,656347.0
literary comics,/works/OL38826537W,The comic vision of Cosi fan tutte,Edmund Joseph Goehring,1993.0,,eng,,,
literary comics,/works/OL45160417W,The comic vision of Così fan tutte,"Goehring, Edmund J., Jr",1993.0,,eng,,,
literary comics,/works/OL32129855W,The comic annual,Thomas Hood,1830.0,,eng,,,
literary comics,/works/OL19268140W,Stray Dogs literary figure 1 (Kadokawa Comics Ace) (2013) ISBN: 4041206731 [Japanese Import],Kadokawa,2013.0,,,,,8432245.0
literary comics,/works/OL32725951W,Tall tales in comic diction,Sandra Eva Boschenhoff,2013.0,,eng,,,
literary comics,/works/OL21697345W,Comics,Harriet E. H. Earle,2020.0,,eng,,,
literary comics,/works/OL21150371W,She and Her Cat,"新海誠, 山口つばさ",2017.0,,eng,,,12750141.0
literary comics,/works/OL15108442M,"A New book of oddities and literary olio, or, Farcical, comical, comi-tragical, tragical historian",,1803.0,,eng,,,
literary comics,/works/OL7509211W,"Wit, humor and the comic in Shakespeare and elsewhere",Arthur Haire Forster,1956.0,,eng,,,
literary comics,/works/OL19761185W,Art Comic,Matthew Thurber,2014.0,,eng,,,
literary comics,/works/OL17906128W,Comic drama,W. D. Howarth,1978.0,,eng,,,4408360.0
literary comics,/works/OL13654255W,Loopholes,John Bruns,2009.0,,eng,,,9043979.0
literary comics,/works/OL4616015W,Hero,perry moore,2007.0,,eng,,,1817686.0
literary comics,/works/OL9024143W,Comic Relations,Pavel Petr,1985.0,,eng,,,4864641.0
literary comics,/works/OL8114989W,La Misteriosa fiamma della Regina Loana,Umberto Eco,2004.0,,"heb, spa, ger, fre, pol",,,275326.0
literary comics,/works/OL5103657W,Krazy Kat,"George Herriman, Chris Ware, Bill Blackbeard, Derya Ataker",1946.0,,"eng, spa",,,6243650.0
literary comics,/works/OL18499178W,The comic tales of Chaucer,"Craik, T. W.",1964.0,,eng,,,13639207.0
literary comics,/works/OL20031827W,Introducing literary criticism,"Holland, Owen (Literary critic)",2015.0,,eng,,,
literary comics,/works/OL27858147W,Victorian Comics,Denis Gifford,2022.0,,eng,,,14761807.0
literary comics,/works/OL19719491W,Encyclopedia of black comics,Sheena C. Howard,2017.0,,eng,,,14462839.0
literary comics,/works/OL19723865W,Comics art in China,John A. Lent,2017.0,,eng,,,13581984.0
literary comics,/works/OL151062W,Vol 714 pour Sydney,Hergé,1968.0,,"eng, fre, wel, ara, chi",,,188985.0
literary comics,/works/OL5959990W,The language of comics,Mario Saraceni,2003.0,,eng,,,1214196.0
literary comics,/works/OL17561898W,Masterpiece Comics,R. Sikoryak,2009.0,,,,,7825374.0
literary comics,/works/OL21499838W,Comics and Language,Hannah Miodrag,2013.0,,eng,,,
literary comics,/works/OL19726150W,Why comics?,Hillary L. Chute,2017.0,,eng,,,12380124.0
literary comics,/works/OL19742919W,Autobiographical comics,Andrew Kunka,2018.0,,eng,,,
literary comics,/works/OL17293479W,Beyond,"Sfe R Monster, Taneka Stotts",2015.0,,eng,,,7383233.0
literary comics,/works/OL31002003W,Superhero Sunday,Stella Palmer,2021.0,,eng,,,
literary comics,/works/OL25206782W,Autobiographical Comics,Andrew J. Kunka,2017.0,,eng,,,
literary comics,/works/OL17635401W,"Shirley Jackson's ""The Lottery""",Miles Hyman,2016.0,,"eng, fre",,,12619536.0
literary comics,/works/OL6093581W,"Comic women, tragic men",Linda Bamber,1977.0,,eng,,,4693107.0
literary comics,/works/OL2194574W,Opera for everyone,Jean Grundy Fanelli,2003.0,,eng,,,7344020.0
literary comics,/works/OL20362691W,No Straight Lines,"Various, Justin Hall",2011.0,,eng,,,9029354.0
literary comics,/works/OL3917629W,Cynthia Ozick's comic art,Sarah Blacher Cohen,1994.0,,eng,,,3935190.0
literary comics,/works/OL25641146W,Snoopy Stars as the World Famous Literary Ace,Charles M. Schulz,1988.0,,eng,,,12700393.0
literary comics,/works/OL21562530W,Comic Book Film Adaptation,Liam Burke,2015.0,,eng,,,14368828.0
literary comics,/works/OL21130051W,Pierrots on the Stage of Desire,Robert F. Storey,2014.0,,eng,,,
literary comics,/works/OL29338368W,Literary Life,Posy Simmonds,,,,,,
literary comics,/works/OL2923383W,Literary life,Posy Simmonds,2003.0,,eng,,,
literary comics,/works/OL22676179M,No Title Exists.,,1833.0,,eng,,,
literary comics,/works/OL20522885W,The Expanding Art of Comics,Thierry Groensteen,2017.0,,eng,,,9173471.0
literary comics,/works/OL21879343W,Hemingway in Comics,Robert K. Elder,2020.0,,eng,,,
literary comics,/works/OL3970821W,Encyclopedia Brown's book of comic strips,Elliot Caplin,1985.0,,eng,,,13868053.0
literary comics,/works/OL21139152W,Max Ride,Marvel Comics,2017.0,,eng,,,14495324.0
literary comics,/works/OL26497642W,Comics of Hergé,Joe Sutliff Sanders,2016.0,,eng,,,
literary comics,/works/OL21508779W,Origins of Comics,"Thierry Smolderen, Bart Beaty, Nick Nguyen",2014.0,,eng,,,
literary comics,/works/OL21098925W,Comics of Joe Sacco,"Daniel Worden, Kevin C. Dunn",2015.0,,eng,,,
literary comics,/works/OL20989337W,Aspects of Genre and Type in Pre-Modern Literary Cultures,"Herman L. J. Vanstiphout, Fernand de Varennes",1999.0,,eng,,,4899724.0
literary comics,/works/OL17499864W,1001 Comics You Must Read Before You Die,Paul Gravett,2011.0,,eng,,,7701509.0
literary comics,/works/OL3854035W,This literary life,Peter van Straaten,1991.0,,eng,,,9250421.0
literary comics,/works/OL21882042W,Comic Art in Museums,Kim A. Munson,2020.0,,eng,,,
literary comics,/works/OL20059253W,Drawing from life,Jane Tolmie,2013.0,,eng,,,12814931.0
literary comics,/works/OL21335639W,Routledge Revivals,David E. E. Sloane,2017.0,,eng,,,12403612.0
literary comics,/works/OL1512543W,Comedies,Publius Terentius Afer,1616.0,,"eng, lat, fre, ger",,,5933128.0
literary comics,/works/OL19669970W,Comics & memory in Latin America,"Jorge L. Catalá-Carrasco, Paulo Drinot, James Scorer",2017.0,,eng,,,
literary comics,/works/OL16572271W,Linguistics and the study of comics,Frank Bramlett,2012.0,,eng,,,9341705.0
literary comics,/works/OL6692108W,The comic style of Beaumarchais,J. B. Ratermanis,1961.0,,eng,,,9994215.0
literary comics,/works/OL17929982W,"My Favorite Thing Is Monsters, vol 1",Emil Ferris,2017.0,,"fre, eng",,,8263418.0
literary comics,/works/OL20923952W,Devil in the Gateway,Mike Carey,2001.0,,eng,,,10296450.0
literary comics,/works/OL3288560W,Pierrots on the stage of desire,Robert F. Storey,1985.0,,eng,,,8487443.0
literary comics,/works/OL18276119W,Samuel Beckett,Ruby Cohn,1962.0,,eng,,,12129681.0
literary comics,/works/OL15829265W,Astro boy,Osamu Tezuka,2002.0,,"spa, eng",,,6793490.0
literary comics,/works/OL20898130W,Cultures of Comics Work,"Casey Brienza, Paddy Johnston",2016.0,,eng,,,10234308.0
literary comics,/works/OL7192709W,The comic element of Montaigne's style,Zoe Samaras,1970.0,,eng,,,14933281.0
literary comics,/works/OL21264416W,Representing Multiculturalism in Comics and Graphic Novels,"Ian Hague, Carolene Ayaka",2014.0,,eng,,,13243832.0
literary comics,/works/OL19954774W,King,Ho Che Anderson,2010.0,,eng,,,9632842.0
literary comics,/works/OL44518490W,Blowing smoke,Adam L. Kern,1997.0,,eng,,,
literary comics,/works/OL16126632W,Critical approaches to comics,Matthew J. Smith,2011.0,,eng,,,
literary comics,/works/OL18333589W,An anthology of Irish comic writing,Ferdia MacAnna,1995.0,,eng,,,13054410.0
literary comics,/works/OL20160647W,Comic Shop,Dan Gearino,2017.0,,eng,,,8806159.0
literary comics,/works/OL15190653W,The Supergirls,Mike Madrid,2009.0,,eng,,,9507113.0
literary comics,/works/OL3058074W,The comic tradition in America,Kenneth Schuyler Lynn,1958.0,,eng,,,9839836.0
literary comics,/works/OL16637434W,"Comics for film, games, and animation",Tyler Weaver,2012.0,,eng,,,14311753.0
literary comics,/works/OL4337501W,Nina ; The comic actor ; An old man's sin,"A. F. Pisemskiĭ, Alexei Pisemsky, Maya Jenkins",1987.0,,"eng, rus",,,4745188.0
literary comics,/works/OL21357827W,"Beowulf's Popular Afterlife in Literature, Comic Books, and Film",Kathleen Forni,2018.0,,eng,,,
literary comics,/works/OL21305954W,Victorian Comic Spirit : New Perspectives,Jennifer Wagner-Lawlor,2017.0,,eng,,,
literary comics,/works/OL2758434W,Hardboiled burlesque,Keith Newlin,1980.0,,eng,,,
literary comics,/works/OL9639207W,This Book Contains Graphic Language,Rocco Versaci,2007.0,,eng,,,2657710.0
literary comics,/works/OL13389226W,The comic matrix of Shakespeare's tragedies,Susan Snyder,1979.0,,eng,,,8801810.0
literary comics,/works/OL9962188M,Plays on a Comic Theme,"Leonard Gershe, Herb Gardner, Johnny Wayne",1979.0,,,,,
literary comics,/works/OL8927227W,Comic Book Culture,Matthew Pustz,1999.0,,eng,,,12188024.0
literary comics,/works/OL21037378W,Midsummer Night's Dream,Classical Comics Staff,2011.0,,eng,,,
literary comics,/works/OL20776961W,Disability in Comic Books and Graphic Narratives,"C. Foss, Jonathan W. Gray, Z. Whalen",2016.0,,eng,,,9845450.0
literary comics,/works/OL24845860W,The Penguin book of Irish comic writing,Ferdia MacAnna,1996.0,,,,,11693512.0
literary comics,/works/OL21245182W,Child Savage 1890-2010,Elisabeth Wesseling,2016.0,,eng,,,
literary comics,/works/OL21672387W,Comic Turn in Contemporary English Fiction,Huw Marsh,2020.0,,eng,,,11021089.0
literary comics,/works/OL21147314W,"Comics, Trauma, and the New Art of War",Harriet E. H. Earle,2017.0,,eng,,,12431741.0
literary comics,/works/OL21281387W,Comic Imagination in Modern African Literature and Cinema,Maik Nwosu,2016.0,,eng,,,
literary comics,/works/OL1887164W,"Comic visions, female voices",Barbara Bennett,1998.0,,eng,,,1526344.0
literary comics,/works/OL32835769W,Sŏsa manhwa kaeron,"Kim, Yong-nak",1999.0,,kor,,,
literary comics,/works/OL4520587W,The comic poems of William Tennant,William Tennant,1989.0,,eng,,,1345145.0
literary comics,/works/OL21775146M,Amateur dramatic entertainment in aid of the Mechanics' Literary Institute,,1982.0,,eng,,,
literary comics,/works/OL26751573W,"Creating Comics As Journalism, Memoir and Nonfiction","Randy Duncan, Michael Ray Taylor, David Stoddard",2015.0,,eng,,,
literary comics,/works/OL20585486W,The Comics of Charles Schulz,"Jared Gardner, Ian Gordon",2017.0,,eng,,,9226979.0
literary comics,/works/OL25345127W,Graphic Novels and Comics As World Literature,"James Hodapp, Thomas Oliver Beebee",2022.0,,eng,,,
literary comics,/works/OL2269469W,Pens and needles,"Levine, David",1969.0,,"eng, ger",,,6550245.0
literary comics,/works/OL1352154W,French comic drama from the sixteenth to the eighteenth century,Geoffrey Brereton,1977.0,,eng,,,8207936.0
literary comics,/works/OL17758278W,Henry James and the comic form,Ronald Wallace,1975.0,,eng,,,4473555.0
literary comics,/works/OL20210447W,The Hernandez Brothers,Enrique Garcia,2017.0,,eng,,,8861298.0
literary comics,/works/OL20930152W,"Comic Books, Graphic Novels and the Holocaust",Claire Gorrara,,,eng,,,
literary comics,/works/OL13640747W,"Shakespeare, Rabelais, and the comical-historical",Cathleen T McLoughlin,1999.0,,eng,,,3736564.0
literary comics,/works/OL20092430W,"Snow, Glass, Apples","Neil Gaiman, Colleen Doran, Diego de los Santos",2019.0,,eng,,,8757611.0
literary comics,/works/OL21613958W,Metaphoricity of Conventionalized Diegetic Images in Comics,Michal Szawerna,2017.0,,eng,,,
literary comics,/works/OL4479253W,Comic tales of the Middle Ages,Marc Wolterbeek,1991.0,,"eng, lat",,,2375160.0
literary comics,/works/OL1951642W,"Shakespeare, Rabelais, and the comical-historical",Cathleen T. McLoughlin,2000.0,,eng,,,3736563.0
literary comics,/works/OL36113629W,Rose Metal Press Field Guide to Graphic Literature,"Kelcey Ervick, Tom Hart",2023.0,,eng,,,
literary comics,/works/OL17868557W,Macbeth - The Graphic Novel,William Shakespeare,1850.0,,"spa, eng, ger, swe",,,9033736.0
literary comics,/works/OL1304652W,The comic style of P. G. Wodehouse,Robert Anderson Hall,1974.0,,eng,,,4509678.0
literary comics,/works/OL17543693W,"Romeo and Juliet the Graphic Novel
            
                Classical Comics",Will Volley,2009.0,,,,,7789019.0
literary comics,/works/OL20895868W,Hotdogger,Karla Oceanak,2013.0,,eng,,,10230304.0
literary comics,/works/OL5798992W,"Berserk, Vol. 6",三浦建太郎,2003.0,,eng,,,869292.0
literary comics,/works/OL17584845W,Narrative Structure In Comics Making Sense Of Fragments,Barbara Postema,2013.0,,,,,7870395.0
literary comics,/works/OL7382970W,The Marvel Comics Guide to New York City,Peter Sanderson,2007.0,,eng,,,2787121.0
literary comics,/works/OL16934129W,Comics as a nexus of cultures,Jochen Ecke,2010.0,,eng,,,9798004.0
literary comics,/works/OL28103059W,Illusions of Time,Dot Hearn,2022.0,,eng,,,
literary comics,/works/OL16420202W,Hark! A Vargrant,Kate Beaton,2011.0,,"eng, fre",,,7414668.0
literary comics,/works/OL23219832W,Gustave Doré,Gustave Doré,2015.0,,eng,,,
literary comics,/works/OL32920703W,Mabu wa kilsondŭl,"Yi, Sŏng-ch'il (Literary author)",2013.0,,kor,,,
literary comics,/works/OL20030663W,Secret teachings of a comic book master,Heidi MacDonald,2015.0,,eng,,,
literary comics,/works/OL28123068W,Mutant Desert Adventure,Santiago,2022.0,,eng,,,
literary comics,/works/OL12265492M,A Quest for the Comic Meaning of Literature,"Carol Joyce, Margaret Dunn",2003.0,,,,,3044736.0
literary comics,/works/OL21866601W,Monstrous Imaginaries,Maaheen Ahmed,2019.0,,eng,,,
literary comics,/works/OL27961404W,Ananda math,"Pradip Paul, Souren Roy, Anant Pai",2006.0,,eng,,,12766389.0
literary comics,/works/OL20001546W,Insider histories of cartooning,Robert C. Harvey,2014.0,,eng,,,14367604.0
literary comics,/works/OL32896515W,Pictures and conversations,"Byron W. Sewell, Mark Burstein, Alan Tannenbaum",2005.0,,eng,,,
literary comics,/works/OL19745563W,The new world,Chris Reynolds,2018.0,,eng,,,
literary comics,/works/OL4286299W,Mark Twain as a literary comedian,David E. E. Sloane,1971.0,,eng,,,10062640.0
literary comics,/works/OL22355094W,Four readability tests on four comic books,MaryAnn Doty Rizzo,2012.0,,eng,,,13811229.0
literary comics,/works/OL35770707W,Frank Johnson,"Chris Byrne, Keith Mayerson, Frank Johnson",2023.0,,eng,,,
literary comics,/works/OL21156770W,Canadian Alternative,"Dominick Grace, Eric Hoffman",2017.0,,eng,,,
literary comics,/works/OL3679939W,The Sunforth chronicles,"Andy Juniper, Andy Junier",2003.0,,eng,,,1646036.0
literary comics,/works/OL25860139W,Misadventures of Wenamun,"Rolf Potts, Cedar Van Tassel",2015.0,,eng,,,13508994.0
literary comics,/works/OL37133265W,"The Scriblerus group, 1714-1735",Brian Tippett,1972.0,,eng,,,
literary comics,/works/OL18915736W,True Brit,"George Khoury, David Roach, Jon B. Cooke, Eric Nolen Weathingon",2004.0,,eng,,,943092.0
literary comics,/works/OL258831W,The Tempest (adaptation),William Shakespeare,1800.0,,"eng, ita",,,11726943.0
