search_term,ol_key,title,author,first_publish_year,publisher,language,subject,isbn,cover_i
adult graphic novel,/works/OL17487154W,Martin Luther King Jr Let Freedom Ring,Lewis Helfand,2013.0,,,,,7676115.0
adult graphic novel,/works/OL6026310W,Go Boy 7,"Peyer, Tom., Tom Peyer, Jon Sommariva, Kris Justice",2004.0,,eng,,,2920957.0
adult graphic novel,/works/OL8640611M,Dracula (Illustrated Classics),,2005.0,,eng,,,
adult graphic novel,/works/OL8945177W,G.I. Joe,"Josh Blaylock, Steve Kurth",2002.0,,eng,,,844694.0
adult graphic novel,/works/OL21226925W,Long Hot Summer,"Eric Stephenson, Jamie Mckelvie",2005.0,,eng,,,844865.0
adult graphic novel,/works/OL8693999M,Madman Boogaloo!,"Mike Allred, Mike Baron, Bernie Mireault, Steve Rude, Bernie Mireault",1999.0,,eng,,,814884.0
adult graphic novel,/works/OL8367734M,Showcase Presents,"Jerry Siegel, Bill Finger, Robert Bernstein, Otto Binder, Jerry Coleman",2006.0,,eng,,,749509.0
adult graphic novel,/works/OL9812907M,"Flash, Book 1","Danny Bilson, Paul DeMeo",2007.0,,eng,,,1729372.0
adult graphic novel,/works/OL20250849W,The Art of Doug Sneyd,"Hugh Hefner, Doug Sneyd",2011.0,,eng,,,8906895.0
adult graphic novel,/works/OL8126720W,Treasure Island [adaptation],Roy Thomas,2008.0,,eng,,,2626129.0
adult graphic novel,/works/OL16118463W,Sarasah,Ryang Ryu,2009.0,,eng,,,8201457.0
adult graphic novel,/works/OL17420765W,Captain America America First,Charles Knauf,2010.0,,,,,7544019.0
adult graphic novel,/works/OL9216001W,Elk's Run,"Joshua Hale Fialkov, Noel Tuazon",2007.0,,eng,,,212488.0
adult graphic novel,/works/OL5856200W,Ultimate Fantastic Four Vol. 9,Mike Carey,2008.0,,eng,,,2626117.0
adult graphic novel,/works/OL12328280M,"The Legendary Couple, Volume 4","Louis Cha, Tony Wong",2002.0,,eng,,,2948212.0
adult graphic novel,/works/OL8811077M,Stronghold,"Phil Hester, Tyler Walpole",2005.0,,eng,,,960466.0
adult graphic novel,/works/OL20647590W,Witchblade Compendium Edition,"David Wohl, Michael Turner, Christina Z., Paul Jenkins, Randy Green, Keu Cha",2006.0,,eng,,,844926.0
adult graphic novel,/works/OL12270939W,Mobile Suit Gundam seed X astray,"Kōichi Tokita, Hajime Yatate, Kouichi Tokita",2006.0,,eng,,,879019.0
adult graphic novel,/works/OL19494041W,Essential X-men,"Chris Claremont, Dave Cockrum, John Byrne",2006.0,,eng,,,536413.0
adult graphic novel,/works/OL20290247W,Witchblade,Ron Marz,2011.0,,,,,8948680.0
adult graphic novel,/works/OL20839606W,Love on the Other Side - A Nagabe Short Story Collection,Nagabe,2020.0,,,,,10147629.0
adult graphic novel,/works/OL9769904W,"Wild Ones, Vol. 3",Kiyo Fujiwara,2008.0,,eng,,,11961418.0
adult graphic novel,/works/OL12255591W,Advent,"Brett A. Burner, Brett Burner, Mike S. Miller",2007.0,,eng,,,1166650.0
adult graphic novel,/works/OL17438225W,New Exiles,Chris Claremont,2009.0,,,,,7578776.0
adult graphic novel,/works/OL790523W,X-Men,Christopher Golden,1998.0,,eng,,,271478.0
adult graphic novel,/works/OL8897676M,Kino no Tabi  Volume 2: Book Two,"Keiichi Sigsawa, Kouhaku Kuroboshi",,,eng,,,878923.0
adult graphic novel,/works/OL19729055W,Cartoon clouds,Joseph Remnant,2012.0,,eng,,,14449256.0
adult graphic novel,/works/OL861440W,Batman/Tarzan,"Ron Marz, Igor Kordey",2000.0,,eng,,,814938.0
adult graphic novel,/works/OL24960639W,"Sakura Taisen, Vol. 4","Ohji Hiroi, Ikku Masa, Kosuke Fujishima",2006.0,,eng,,,879088.0
adult graphic novel,/works/OL21009393W,"Rock, Death, Fake, Revenge, and Alone","Rob Reger, Jessica Gruner, Buzz Parker",2014.0,,eng,,,10751890.0
adult graphic novel,/works/OL17533828W,Spiderman Loves Mary Jane Sophomore Jinx,Guillem Mari,2009.0,,,,,7769302.0
adult graphic novel,/works/OL20121202W,Breaking Glass,"Mariko Tamaki, Steve Pugh",2019.0,,,,,8775768.0
adult graphic novel,/works/OL12328271M,Storm Riders Part II,"Wing Shing Ma, Wing Shing Ma",2003.0,,eng,,,2948207.0
adult graphic novel,/works/OL17568224W,"Counter X Volume 3
            
                Counter X",Warren Ellis,2008.0,,,,,7838013.0
adult graphic novel,/works/OL3625667W,Go Boy 7,"Brian Augustyn, Jon Sommariva, Todd Demong, Kris Justice",2004.0,,eng,,,2958388.0
adult graphic novel,/works/OL8694325M,"Betrayal (Star Wars: Empire, Vol. 1)","Scott Allie, Ryan Benjamin, Curtis Arnold",2003.0,,eng,,,1912339.0
adult graphic novel,/works/OL9873751M,"Storm Riders, Volume 10","Wing Shing Ma, Wing Shing Ma",2003.0,,eng,,,1964608.0
adult graphic novel,/works/OL9622483M,"Storm Riders, Volume 9","Wing Shing Ma, Wing Shing Ma",2003.0,,eng,,,1964607.0
adult graphic novel,/works/OL13749151W,Gakuen Alice,Higuchi Tachibana,2007.0,,eng,,,10673907.0
adult graphic novel,/works/OL43185233W,Motherlover,Lindsay Ishihiro,2025.0,,eng,,,14948388.0
adult graphic novel,/works/OL43745235W,"Ultimate Spider-Man, Vol. 15","Brian Michael Bendis, Mark Bagley",2006.0,,eng,,,14835870.0
adult graphic novel,/works/OL18917864W,Star wars,"W. Haden Blackman, John Ostrander, Scott Allie, Jan Duursema, Stephen Thompson, Tomas Giorello",2006.0,,spa,,,869529.0
adult graphic novel,/works/OL3083830W,The pilgrim's progress,"Martin Powell, Seppo Makinen, Bob Downs",1992.0,,eng,,,
adult graphic novel,/works/OL790110W,Livewires,"Adam Warren, Rick Mays, Jason Martin",2005.0,,eng,,,535940.0
adult graphic novel,/works/OL22491805W,Macanudo 2,Liniers,2005.0,,spa,,,10471194.0
adult graphic novel,/works/OL8749002M,Hero Comic 4,"Stephen R. Lawhead, Ross Lawhead",2003.0,,eng,,,831742.0
adult graphic novel,/works/OL17534973W,The Amazing Spiderman Presents,Zeb Wells,2010.0,,,,,7771578.0
adult graphic novel,/works/OL11761145M,Star Wars Tales 2 (Star Wars Tales (Sagebrush)),,2002.0,,eng,,,2788170.0
adult graphic novel,/works/OL21022886W,Civil War,"David Hine, Yanick Paquette",2007.0,,eng,,,536382.0
adult graphic novel,/works/OL17412441W,Star Comics Allstar Collection,Lenny Herman,2009.0,,,,,7527582.0
adult graphic novel,/works/OL12069584W,Sidekicks,"J. Torres, Takeshi Miyazawa",2003.0,,eng,,,954345.0
adult graphic novel,/works/OL11628214W,Jabba the Hutt,"Jim Woodring, Jim Woodring, Art Wetherell",1998.0,,eng,,,814813.0
adult graphic novel,/works/OL21012417W,Civil War,"Matt Fraction, Ariel Olivetti, Mike Deodato Jr.",2007.0,,eng,,,536384.0
adult graphic novel,/works/OL38050738W,17776,Jon Bois,2017.0,,,,,15207234.0
adult graphic novel,/works/OL13742280W,Neba giba!,Hiromu Mutō,2006.0,,eng,,,9284747.0
adult graphic novel,/works/OL8830988M,"Heaven Sword & Dragon Sabre, Vol. 2","Louis Cha, Wing Shing Ma",2002.0,,eng,,,857290.0
adult graphic novel,/works/OL8786843M,Micronauts,"Scott Wherle, Eric Wolfe Hanson, E.J. Su",2003.0,,eng,,,844725.0
adult graphic novel,/works/OL20027037W,The activity,Nathan Edmondson,2013.0,,eng,,,
adult graphic novel,/works/OL15095171W,Ultimate X-Men,Geoff Johns,2006.0,,eng,,,536327.0
adult graphic novel,/works/OL8809091W,+Anima Scholastic Exclusive  Volume 3,Natsumi Mukai,2007.0,,eng,,,11392352.0
adult graphic novel,/works/OL20655817W,The Lynda Barry Experience,Lynda Barry,1993.0,,eng,,,9309701.0
adult graphic novel,/works/OL17392371W,Young Xmen,Yanick Paquette,2008.0,,eng,,,7487635.0
adult graphic novel,/works/OL43760182W,Ultimate Spider-Man Vol. 8,"Brian Michael Bendis, Mark Bagley",2003.0,,eng,,,535825.0
adult graphic novel,/works/OL24825586W,Eternity,"Jin-Ryong Park, Yong-Gwan Shin",2005.0,,eng,,,865944.0
adult graphic novel,/works/OL1832539W,The Call of the Wild,"Stephen Feinstein, Jack London",1998.0,,eng,,,2914361.0
adult graphic novel,/works/OL20159775W,"Yona of the Dawn, Vol. 17",Mizuho Kusanagi,2019.0,,,,,8805133.0
adult graphic novel,/works/OL17383029W,Guardians Of The Galaxy,Dan Abnett,2010.0,,,,,7468980.0
adult graphic novel,/works/OL20453097W,Super Spy,Matt Kindt,2010.0,,,,,9119087.0
adult graphic novel,/works/OL15056193W,Hack ai Buster 2 (.Hack AI Buster),Tatsuya Hamazaki,2006.0,,eng,,,878905.0
adult graphic novel,/works/OL12710226W,Chaos,J. S. Earls,2009.0,,eng,,,
adult graphic novel,/works/OL28176821W,Ted Noodleman,"Jim Keplinger, Ryan Ottley",2005.0,,eng,,,961914.0
adult graphic novel,/works/OL13755389W,A day in the life,"Paul Jenkins, Paul Jenkins, Mark Buckingham",2001.0,,eng,,,535543.0
adult graphic novel,/works/OL20358774W,Nexus Omnibus Volume 2,Mike Baron,2013.0,,,,,9025511.0
adult graphic novel,/works/OL17533496W,"Architects of Forever
            
                SHIELD",Jonathan Hickman,2011.0,,,,,7768643.0
adult graphic novel,/works/OL8557440M,Astronauts in Trouble ,"Larry Young, Charlie Adlard",2000.0,,eng,,,733394.0
adult graphic novel,/works/OL18662413W,Mister X,Dean Motter,2009.0,,eng,,,12863382.0
adult graphic novel,/works/OL17500573W,Shatterwood,Mello Yello,2012.0,,,,,7702927.0
adult graphic novel,/works/OL17380184W,Dark Reign,Frank Tieri,2009.0,,,,,7463298.0
adult graphic novel,/works/OL17375458W,Sensitive Creatures,Mandy Ord,2012.0,,eng,,,7453856.0
adult graphic novel,/works/OL17387674W,Dark Reign,Rob DiSalvo,2010.0,,,,,7478257.0
adult graphic novel,/works/OL20551947W,The Rising of the Shield Hero Volume 11,アネコユサギ,2018.0,,eng,,,9194358.0
adult graphic novel,/works/OL17482547W,Nights Of Wundagore,David Michelinie,2009.0,,,,,7666895.0
adult graphic novel,/works/OL15490459W,The invisible man,"Sean Taylor, Sean Taylor",2009.0,,eng,,,12776221.0
adult graphic novel,/works/OL43745425W,"Ultimate Spider-Man, Vol. 4","Brian Michael Bendis, Mark Bagley",2002.0,,eng,,,15105356.0
adult graphic novel,/works/OL43760324W,"Ultimate Spider-Man, Vol. 11","Brian Michael Bendis, Mark Bagley",2004.0,,eng,,,535879.0
adult graphic novel,/works/OL17536754W,Morning Glories,Joe Eisma,2011.0,,,,,7775151.0
adult graphic novel,/works/OL4805562W,Marvel Adventures Incredible Hulk Vol. 2,Paul Benjamin,2008.0,,eng,,,2626144.0
adult graphic novel,/works/OL20017170W,Snapshots of a girl,Beldan Sezen,2015.0,,eng,,,12837890.0
adult graphic novel,/works/OL721159W,Los clásicos según Fontanarrosa,"Fontanarrosa, Roberto Fontanarrosa, Fontanarrosa",1988.0,,spa,,,
adult graphic novel,/works/OL21011947W,Asgardian Wars,"Chris Claremont, Paul Smith, Arthur Adams",,,,,,6375218.0
adult graphic novel,/works/OL18169393W,Someday's dreamers,"Kumichi Yoshizuki, Norie Yamada",2006.0,,eng,,,878789.0
adult graphic novel,/works/OL861451W,Jango Fett,Ron Marz,2002.0,,eng,,,11657978.0
adult graphic novel,/works/OL17434429W,Boris Karloff Tales Of Mystery Archives,Dick Wood,2011.0,,,,,7571175.0
adult graphic novel,/works/OL8211890W,らんま½ 31,高橋留美子,2001.0,,"jpn, spa, eng",,,3122505.0
adult graphic novel,/works/OL21282297W,More Words about Pictures,"Perry Nodelman, Naomi Hamer, Mavis Reimer",2017.0,,eng,,,13746681.0
adult graphic novel,/works/OL43768591W,"Ultimate Spider-Man, Vol. 8",,2007.0,,eng,,,536425.0
adult graphic novel,/works/OL17426442W,Lucky Star,Kagami Yoshimizu,2011.0,,,,,7555214.0
adult graphic novel,/works/OL17395706W,The Avengers Disassembled Iron Man Thor Captain America,John Jackson Miller,2009.0,,,,,7494312.0
adult graphic novel,/works/OL9688500M,The Snak Posse (S.N.A.K. Posse),"David Pettigrew, Robert Orchanian",1997.0,,eng,,,1698139.0
adult graphic novel,/works/OL13155319M,El Santos 2,"Jose Trinidad Camacho Orozco (Trino), Jose Ignacio Solorzano Perez (Jis)",2006.0,,spa,,,3355653.0
adult graphic novel,/works/OL5748480W,Showcase presents the Atom,"Gardner F. Fox, Gil Kane",2007.0,,eng,,,1729448.0
adult graphic novel,/works/OL13320363M,Magola,"Adriana Mosquera Soto, Nani",2001.0,,spa,,,
adult graphic novel,/works/OL20047365W,MWD,Brian David Johnson,2017.0,,eng,,,14499161.0
adult graphic novel,/works/OL8694170M,Star Wars,"Tim Truman, Davide Fabbri, Christian Dalla Vecchia, Dave McCai",2002.0,,eng,,,815082.0
adult graphic novel,/works/OL8694098M,"Emissaries to Malastare (Star Wars: Ongoing, Volume 3)","Tim Truman, Tom Lyle, Robert Jones",2001.0,,eng,,,815007.0
adult graphic novel,/works/OL19958962W,Puella magi,Hanokage (Artist),2012.0,,eng,,,11700394.0
adult graphic novel,/works/OL9769903W,"Wild Ones, Vol. 2 (Wild Ones)",Kiyo Fujiwara,2008.0,,eng,,,2806223.0
adult graphic novel,/works/OL21007159W,Eternals Saga,"Roy Thomas, Walt Simonson, John Buscema, Keith Pollard, Arvell Jones",2006.0,,eng,,,536414.0
adult graphic novel,/works/OL43767318W,"Ultimate Spider-Man, Vol. 13","Brian Michael Bendis, Mark Bagley",2005.0,,eng,,,536018.0
adult graphic novel,/works/OL43767676W,"Ultimate Spider-Man, Vol. 16","Brian Michael Bendis, Mark Bagley, Mark Brooks",2006.0,,eng,,,536206.0
adult graphic novel,/works/OL43767975W,"Ultimate Spider-Man, Vol. 18","Brian Michael Bendis, Mark Bagley",2007.0,,eng,,,1464792.0
adult graphic novel,/works/OL19747692W,Bloody Mary,Akaza Samamiya,2016.0,,eng,,,
adult graphic novel,/works/OL15573106W,The time machine,Lewis Helfand,2009.0,,eng,,,10348088.0
adult graphic novel,/works/OL2888275W,The Invincible Iron Man :--Extremis,Warren Ellis,2007.0,,eng,,,13151526.0
adult graphic novel,/works/OL17549960W,"Live Fast
            
                Runaways Marvel Paperback",Brian K. Vaughan,,,,,,7801551.0
adult graphic novel,/works/OL43776537W,"Ultimate X-Men, Vol. 8","Brian Michael Bendis, David Finch",2004.0,,eng,,,11294754.0
adult graphic novel,/works/OL9137851M,Mundo Quino,"Joaquin Salvador Lavado, Quino",1998.0,,,,,2291193.0
adult graphic novel,/works/OL8893978M,The World of Disgaea,"Tadanobu Isono, Yoji Kameishi, Shosuke Masuda",2007.0,,eng,,,877988.0
adult graphic novel,/works/OL19294251W,Exiles,"Chuck Austen, Clayton Henry, Mark Morales, Marvel Comics",2003.0,,eng,,,4724922.0
adult graphic novel,/works/OL21007277W,Marvel 1985,"Mark Millar, Tommy Lee Edwards",,,eng,,,12976733.0
adult graphic novel,/works/OL8897768W,Mobile suit gundam wing,"Akemi Omode, Akemi Omoide, Sakura Asagi",2001.0,,eng,,,813732.0
adult graphic novel,/works/OL42527187W,Gender-Kram,Louie Läuger,2020.0,,"eng, ger",,,14843864.0
adult graphic novel,/works/OL21013980W,Hatter M Volume Two - Mad with Wonder,"Frank Beddor, Liz Cavalier",2009.0,,eng,,,7641240.0
adult graphic novel,/works/OL19948321W,Lola,J. Torres,2010.0,,eng,,,14409728.0
adult graphic novel,/works/OL15728465W,400 BC Story of the Ten Thousand,Lewis Helfand,2011.0,,,,,6746273.0
adult graphic novel,/works/OL11821852M,Dump-Viz Greatest Hits-32copies,,2005.0,,eng,,,
adult graphic novel,/works/OL20042169W,Haikyu!,古舘 春一,2016.0,,eng,,,14625796.0
adult graphic novel,/works/OL18563967W,The hipless boy,"Sully, Sherwin Tjia",2009.0,,eng,,,13541428.0
adult graphic novel,/works/OL17452088W,Marvel Apes,Ramon Bachs,2009.0,,eng,,,7606406.0
adult graphic novel,/works/OL9128862W,THE BUILDING OPPOSITE Volume 1,Vanyda,2007.0,,eng,,,1048543.0
adult graphic novel,/works/OL9066880W,Mamotte Shugogetten Volume 2 (Mamotte Shugogetten),Minene Sakurano,2008.0,,eng,,,11818892.0
adult graphic novel,/works/OL20013312W,Witch buster,Jung-Man Cho,2015.0,,eng,,,
adult graphic novel,/works/OL17553602W,Twisted Savage Dragon Funnies,Jonathan Chan,2011.0,,,,,7808833.0
adult graphic novel,/works/OL24253595W,Cemetery Girl,Joseph Cognard,2012.0,,eng,,,10738207.0
adult graphic novel,/works/OL43767252W,"Ultimate Spider-Man, Vol. 12","Brian Michael Bendis, Mark Bagley, Scott Hanna",2005.0,,eng,,,536011.0
adult graphic novel,/works/OL43767249W,"Ultimate Spider-Man, Vol. 14","Brian Michael Bendis, Mark Bagley, Scott Hanna",2005.0,,eng,,,536044.0
adult graphic novel,/works/OL8414084M,Elfquest - Hidden Years,"Wendy Pini, Richard Pini",1993.0,,eng,,,715092.0
adult graphic novel,/works/OL9560737M,Harlem Beat #03 (Harlem Beat),"Nuriko Nishiyama, Yuriko Nishiyama",2003.0,,eng,,,
adult graphic novel,/works/OL13539772W,Captain America and the falcon,"Priest Sears, Christopher J. Priest, Bart Sears",2004.0,,eng,,,535887.0
adult graphic novel,/works/OL20037178W,Say I love you,Kanae Hazuki,2016.0,,eng,,,12664988.0
adult graphic novel,/works/OL20053835W,Bleach. 3-in-1 edition,Tite Kubo,2017.0,,eng,,,14624990.0
adult graphic novel,/works/OL8869746M,"The Imperial Perspective (Star Wars: Empire, Vol. 3)","Welles Hartley, Paul Alden, Jeremy Barlow, Davide Fabbri, Brian Ching, Raul Trevino, Patrick Blaine",2004.0,,eng,,,869248.0
adult graphic novel,/works/OL8694094M,Star Wars - Jedi Council,"Randy Stradley, Davide Fabbri, Christian Dalla Vecchia",2001.0,,eng,,,815003.0
adult graphic novel,/works/OL17431285W,Hero By Design,Fred Van Lente,2008.0,,,,,7564898.0
adult graphic novel,/works/OL17409897W,Lost Adventures,Stan Lee,2009.0,,,,,7522559.0
adult graphic novel,/works/OL17420701W,Daredevil The Man Without Fear,David Aja,2009.0,,,,,7543893.0
adult graphic novel,/works/OL45147602W,Coterie of Liars,Kate Weston,2026.0,,eng,,,
adult graphic novel,/works/OL24283642W,Love story à l'iranienne,Jane Deuxard,2015.0,,fre,,,10783336.0
adult graphic novel,/works/OL14966984W,Ultimate Galactus Vol. 3,Warren Ellis,2006.0,,eng,,,535929.0
adult graphic novel,/works/OL20756618W,Good for Nothings,Danielle Banas,2020.0,,eng,,,14619696.0
adult graphic novel,/works/OL17397001W,Genshiken Omnibus,Shimoku Kio,2012.0,,,,,7496901.0
adult graphic novel,/works/OL20474165W,"Durarara!!, Vol. 3","成田良悟, ヤスダスズヒト",2016.0,,,,,9138930.0
adult graphic novel,/works/OL8548292W,X-Men,Greg Pak,2008.0,,eng,,,1464763.0
adult graphic novel,/works/OL9000028W,Real Fake Princess Volume 1 (Real/Fake Princess),I-Haun,2006.0,,eng,,,878607.0
adult graphic novel,/works/OL17549687W,Nothing Nice to Say,Mitch Clem,2008.0,,,,,7801009.0
adult graphic novel,/works/OL9153447M,Vampire Princess Miyu 7,"Narumi Kakinouchi, Toshiki Hirano",,,spa,,,4918605.0
adult graphic novel,/works/OL9153451M,Vampire Princess Miyu 9,"Narumi Kakinouchi, Toshiki Hirano",,,spa,,,4918201.0
adult graphic novel,/works/OL10979246M,X-Men 2 Backpack (Backpack Marvels),"Marvel Books, Chris Claremont",2000.0,,eng,,,
adult graphic novel,/works/OL9153445M,Vampire Princess Miyu 5,"Narumi Kakinouchi, Toshiki Hirano",,,spa,,,4918567.0
adult graphic novel,/works/OL9000761W,Never Give Up Volume 4 (Never Give Up),Hiromu Mutou,2007.0,,eng,,,878786.0
adult graphic novel,/works/OL19747062W,Street Angel goes to juvie,Jim Rugg,2018.0,,eng,,,
adult graphic novel,/works/OL21229191W,Street Fighter,"Ken Siu-Chong, Alvin Lee, Arnold Tsang, UDON",2006.0,,eng,,,743532.0
adult graphic novel,/works/OL28598579W,Star Wars - Boba Fett,"John Wagner, Ian Gibson, Variou",1999.0,,eng,,,814888.0
adult graphic novel,/works/OL8822496W,The making of astronauts in trouble,Larry Young,1999.0,,eng,,,733391.0
illustrated novel,/works/OL5278311W,The most dangerous game,Richard Connell,1990.0,,eng,,,8561531.0
illustrated novel,/works/OL1253285W,The Scarlet Pimpernel,Emma Orczy,1900.0,,"spa, pol, sun, fre, chi",,,479102.0
illustrated novel,/works/OL2779754W,On the Beach,Nevil Shute,1957.0,,"rus, dut, eng, ger, heb",,,997896.0
illustrated novel,/works/OL44990W,The Woodlanders,Thomas Hardy,1800.0,,eng,,,8243078.0
illustrated novel,/works/OL1095403W,"Villette, a novel",Charlotte Brontë,1853.0,,"eng, spa, ger, por",,,5737854.0
illustrated novel,/works/OL15437W,Lilith,George MacDonald,1895.0,,"eng, ita, ger, fre",,,14364546.0
illustrated novel,/works/OL2234917W,Whose Body?,Dorothy L. Sayers,1923.0,,"rus, eng, ger, fre",,,8311819.0
illustrated novel,/works/OL39316W,The Waves,Virginia Woolf,1931.0,,"ita, dut, spa, fre, dan",,,119517.0
illustrated novel,/works/OL66614W,Lady Susan,Jane Austen,1925.0,,"fre, pol, ger, spa, por",,,12641526.0
illustrated novel,/works/OL99541W,The Enchanted Castle,Edith Nesbit,1907.0,,"chi, eng, spa, por",,,6644514.0
illustrated novel,/works/OL16313W,Vanity Fair,William Makepeace Thackeray,1800.0,,"spa, rus, chi, eng, ger",,,417329.0
illustrated novel,/works/OL66544W,Persuasion,Jane Austen,1789.0,,"chi, rus, und, vie, fre",,,12824691.0
illustrated novel,/works/OL505944W,The Razor's Edge,William Somerset Maugham,1944.0,,"chi, fre, ita, eng, spa",,,97505.0
illustrated novel,/works/OL77775W,The blue castle,Lucy Maud Montgomery,1926.0,,"chi, eng, fre",,,14640067.0
illustrated novel,/works/OL15449W,The Princess and the Goblin,George MacDonald,1872.0,,"chi, heb, eng, ger",,,14363454.0
illustrated novel,/works/OL262384W,The Sea Fairies,L. Frank Baum,1911.0,,"rus, eng",,,1814237.0
illustrated novel,/works/OL19899W,Just So Stories,Rudyard Kipling,1922.0,,"spa, eng",,,36215.0
illustrated novel,/works/OL2771987W,Herland,"Charlotte Perkins Gilman, Alex Goody, Eva Kumar, Evelynn D. Smith, Chavdar Georgiev, Booking, Aurora Irvine",1915.0,,"spa, fre, rus, chi, eng",,,448130.0
illustrated novel,/works/OL44994W,The Return of the Native,Thomas Hardy,1878.0,,"chi, und, eng, pan, tur",,,8162989.0
illustrated novel,/works/OL19908W,Kim,Rudyard Kipling,1901.0,,"fre, pol, ger, heb, chi",,,1053011.0
illustrated novel,/works/OL66513W,Emma,Jane Austen,1815.0,,"gre, chi, rus, und, dut",,,9278312.0
illustrated novel,/works/OL99539W,The Phoenix and the Carpet,Edith Nesbit,1903.0,,"eng, ger",,,902122.0
illustrated novel,/works/OL99509W,The Railway Children,Edith Nesbit,1900.0,,"chi, tur, ita, heb, eng",,,13241123.0
illustrated novel,/works/OL468362W,The Beautiful and Damned,F. Scott Fitzgerald,1920.0,,"ita, spa, chi, eng, ger",,,7152019.0
illustrated novel,/works/OL2827199W,Life of Pi,Yann Martel,2000.0,,"spa, pol, fre, rus, dan",,,12840573.0
illustrated novel,/works/OL54059W,Roughing It,Mark Twain,1872.0,,"fre, eng, pol, ger",,,9165528.0
illustrated novel,/works/OL112003W,Lust for Life,Irving Stone,1934.0,,"hun, pol, slo, heb, cze",,,6617761.0
illustrated novel,/works/OL14868510W,Bleak House,Charles Dickens,1850.0,,"chi, dut, fre, eng, spa",,,9279273.0
illustrated novel,/works/OL99499W,Five Children and It,Edith Nesbit,1905.0,,"chi, und, fre, ita, pol",,,28174.0
illustrated novel,/works/OL85891W,The Jewel of Seven Stars,Bram Stoker,1902.0,,"ger, eng",,,2760301.0
illustrated novel,/works/OL16804289W,Inferno,Dan Brown,2013.0,,"por, heb, ger, eng, rus",,,9322673.0
illustrated novel,/works/OL450124W,The Last Man,Mary Shelley,1826.0,,"ita, eng, ger",,,882662.0
illustrated novel,/works/OL39329W,Jacob's Room,Virginia Woolf,1922.0,,"ita, dut, spa, fre, eng",,,2894970.0
illustrated novel,/works/OL66534W,Northanger Abbey,Jane Austen,1818.0,,"ita, spa, pol, fre, cat",,,12567961.0
illustrated novel,/works/OL472542W,The Secret of Chimneys,Agatha Christie,1925.0,,"ita, spa, fre, eng, ger",,,12996574.0
illustrated novel,/works/OL17453W,She,H. Rider Haggard,1886.0,,"chi, pol, fre, cor, urd",,,295537.0
illustrated novel,/works/OL51145W,It Can't Happen Here,Sinclair Lewis,1935.0,,"rus, eng, und",,,12719018.0
illustrated novel,/works/OL15450W,Phantastes,George MacDonald,1850.0,,"eng, por, fre, spa",,,14358814.0
illustrated novel,/works/OL12791W,My Ántonia,Willa Cather,1818.0,,"ita, spa, cze, urd, fre",,,8369013.0
illustrated novel,/works/OL86320W,Dubliners,James Joyce,1914.0,,"tur, jpn, cze, chi, rus",,,8216412.0
illustrated novel,/works/OL176045W,The Woman in White,"Wilkie Collins, William Collins",1859.0,,"dut, ita, spa, fre, rus",,,4684227.0
illustrated novel,/works/OL276470W,The Ambassadors,Henry James,1903.0,,"chi, eng, fre, spa",,,313610.0
illustrated novel,/works/OL52260W,The First Men in the Moon,H. G. Wells,1900.0,,"rus, gle, mul, pol, fre",,,8081288.0
illustrated novel,/works/OL77764W,Anne's House of Dreams,Lucy Maud Montgomery,1917.0,,"ger, eng, fre, pol, dan",,,14640440.0
illustrated novel,/works/OL468488W,This Side of Paradise,F. Scott Fitzgerald,1920.0,,"eng, spa, por",,,8243609.0
illustrated novel,/works/OL407476W,The Story of the Amulet,Edith Nesbit,1905.0,,"fre, ger, heb, chi, eng",,,13241470.0
illustrated novel,/works/OL81294W,Women in Love,D. H. Lawrence,1877.0,,"por, ger, eng, fre, cze",,,13140934.0
illustrated novel,/works/OL505730W,The Magician,William Somerset Maugham,1908.0,,"chi, rus, eng, ger, por",,,2789948.0
illustrated novel,/works/OL38684W,Lord Jim,Joseph Conrad,1900.0,,"pol, und, chi, fre, eng",,,8236295.0
illustrated novel,/works/OL262505W,The Valley of Fear,Arthur Conan Doyle,1914.0,,"ita, spa, pol, fre, cat",,,8350377.0
illustrated novel,/works/OL4322177W,Daddy-Long-Legs,Jean Webster,1912.0,,"spa, pol, fre, chi, eng",,,8266414.0
illustrated novel,/works/OL1095397W,Shirley,Charlotte Brontë,1800.0,,"rus, und, fre, ita, eng",,,11024634.0
illustrated novel,/works/OL39349W,Mrs. Dalloway,Virginia Woolf,1925.0,,"fin, hun, chi, dan, heb",,,6397580.0
illustrated novel,/works/OL13162727W,Our Mutual Friend,"Charles Dickens, Margeret Tarner, Adam Leverton",1800.0,,"und, dut, fre, ita, eng",,,13136200.0
illustrated novel,/works/OL468485W,Tender is the Night,F. Scott Fitzgerald,1933.0,,"ita, eng, kor, dut, fre",,,6984433.0
illustrated novel,/works/OL39396W,To the Lighthouse,Virginia Woolf,1927.0,,"ita, dut, spa, fre, dan",,,8231846.0
illustrated novel,/works/OL77747W,Anne of Ingleside,Lucy Maud Montgomery,1939.0,,"ger, eng, fre, pol, spa",,,14640696.0
illustrated novel,/works/OL69612W,The Secret Garden,Frances Hodgson Burnett,1911.0,,"chi, und, fre, cat, eng",,,12622062.0
illustrated novel,/works/OL17448W,King Solomon's Mines,H. Rider Haggard,1880.0,,"sun, rus, baq, ger, tur",,,8665393.0
illustrated novel,/works/OL45790W,Charlie and the Chocolate Factory,Roald Dahl,1964.0,,"sco, nor, ger, ita, eng",,,12459564.0
illustrated novel,/works/OL77744W,Anne of Avonlea,Lucy Maud Montgomery,1909.0,,"heb, ger, eng, fre, pol",,,14638062.0
illustrated novel,/works/OL166923W,Игрокъ,Фёдор Михайлович Достоевский,1866.0,,"por, ger, eng, rus, fre",,,3293339.0
illustrated novel,/works/OL99529W,The Book of Dragons,Edith Nesbit,1973.0,,"spa, eng, fre",,,4342323.0
illustrated novel,/works/OL28570037W,The Wind in the Willows,Kenneth Grahame,1908.0,,"chi, dan, san, vie, pol",,,13335427.0
illustrated novel,/works/OL63072W,A Farewell to Arms,Ernest Hemingway,1929.0,,"chi, heb, kur, jpn, afr",,,7226599.0
illustrated novel,/works/OL893415W,Dune,Frank Herbert,1965.0,,"gre, rus, fre, pol, eng",,,11481354.0
illustrated novel,/works/OL453657W,The Colour of Magic,Terry Pratchett,1983.0,,"yid, por, ger, eng, rus",,,14647238.0
illustrated novel,/works/OL52556W,Die Leiden des jungen Werthers,Johann Wolfgang von Goethe,1779.0,,"ita, baq, spa, arm, fre",,,7187281.0
