search_term,ol_key,title,author,first_publish_year,publisher,language,subject,isbn,cover_i
graphic novel,/works/OL24244816W,Allergic,"Megan Wagner Lloyd, Michelle Mee Nutter",2021.0,,eng,,,10724638.0
graphic novel,/works/OL24793569W,The Alchemist Graphic Novel,Paulo Coelho,2010.0,,eng,,,11556106.0
graphic novel,/works/OL15902631W,The Kite Runner--the graphic novel,Khaled Hosseini,2011.0,,"eng, ara",,,8063795.0
graphic novel,/works/OL16793507W,Drama,Raina Telgemeier,2012.0,,"spa, fre, eng",,,12360868.0
graphic novel,/works/OL28062430W,Moon Rising,Tui T. Sutherland,2022.0,,eng,,,15099568.0
graphic novel,/works/OL15445307W,The lightning thief,"Robert Venditti, Rick Riordan",2005.0,,"pol, eng, spa, tur, ita",,,13027680.0
graphic novel,/works/OL17081974W,The Crossover,Kwame Alexander,2014.0,,"spa, eng",,,7336870.0
graphic novel,/works/OL21354339W,The Handmaid's Tale [Graphic Novel],Renee Nault,2019.0,,"spa, eng",,,14339099.0
graphic novel,/works/OL17854075W,Speak. The Graphic Novel,Laurie Halse Anderson,2018.0,,"eng, spa, ita",,,8155119.0
graphic novel,/works/OL2096536W,Watership Down,Richard Adams,1972.0,,"heb, kor, chi, rus, ger",,,6450196.0
graphic novel,/works/OL13752343W,Coraline,"P. Craig Russell, Neil Gaiman",2008.0,,eng,,,7277321.0
graphic novel,/works/OL19728189W,The dragonet prophecy [graphic novel],Barry Deutsch,2018.0,,eng,,,15121740.0
graphic novel,/works/OL19736697W,Eagle Strike (Alex Rider Graphic Novel),"Anthony Horowitz, Antony Johnston, Kanako Damerum, Yuzuru Takasaki",2003.0,,eng,,,9347465.0
graphic novel,/works/OL8117947W,Kristy's Great Idea (graphic novel),Raina Telgemeier,2006.0,,eng,,,279181.0
graphic novel,/works/OL20523543W,The hidden kingdom [graphic novel],Barry Deutsch,2000.0,,eng,,,9174201.0
graphic novel,/works/OL19360520W,The Lost Hero Graphic Novel,Robert Venditti,2014.0,,eng,,,8476152.0
graphic novel,/works/OL5720027W,New Moon,Stephenie Meyer,2006.0,,"eng, swe, cze, fre, pol",,,12643406.0
graphic novel,/works/OL16591739W,The Red Pyramid,Orpheus Collar,2012.0,,"eng, spa",,,7386546.0
graphic novel,/works/OL14952335W,Point Blanc Graphic Novel,"Anthony Horowitz, Antony Johnston",2007.0,,eng,,,2993891.0
graphic novel,/works/OL98288W,Monster,Walter Dean Myers,1999.0,,eng,,,10413044.0
graphic novel,/works/OL5720023W,Twilight,Stephenie Meyer,2005.0,,"eng, ara, fre, tur, pol",,,12641977.0
graphic novel,/works/OL455327W,Lord of the Flies,William Golding,1954.0,,"chi, rus, glg, ita, dut",,,8684447.0
graphic novel,/works/OL19744467W,The Fourth Closet,"Scott Cawthon, Kira Breed-Wrisley",2021.0,,"pol, eng",,,9320331.0
graphic novel,/works/OL17092593W,Champion,"Marie Lu, Steven Kaplan, Mariel Stern",2013.0,,eng,,,8371540.0
graphic novel,/works/OL16557703W,Prodigy,Marie Lu,2012.0,,"eng, chi, fre",,,9257778.0
graphic novel,/works/OL17199409W,Artemis Fowl. The Graphic Novel,"Eoin Colfer, Andrew Donkin, Michael Moreci, Stephen Gilpin",2007.0,,"eng, spa",,,12636250.0
graphic novel,/works/OL16591738W,The Titan's Curse,Robert Venditti,2013.0,,"spa, dut, pol, eng",,,12179554.0
graphic novel,/works/OL1168083W,Nineteen Eighty-Four,George Orwell,1949.0,,"swe, rus, ita, fre, eng",,,9267242.0
graphic novel,/works/OL8699270W,Swan,"Kyoko Ariyoshi, Kyōko Ariyoshi, ariyoshi Kyoko, Ariyoshi Kyoko",2004.0,,eng,,,2737774.0
graphic novel,/works/OL15155002W,The Ugly Duckling,Hans Christian Andersen,1851.0,,"eng, dan, jpn, pol, fre",,,446546.0
graphic novel,/works/OL17835915W,Stormbreaker,Anthony Horowitz,2006.0,,eng,,,8130008.0
graphic novel,/works/OL1230613W,L’étranger,Albert Camus,1942.0,,"swe, ita, kur, fre, eng",,,13151269.0
graphic novel,/works/OL21835701W,Twisted Ones,"Kira Breed-Wrisley, Scott Cawthon",2021.0,,"pol, eng",,,10673740.0
graphic novel,/works/OL262460W,The Lost World,Arthur Conan Doyle,1900.0,,"fin, spa, eng, chi, ita",,,8231444.0
graphic novel,/works/OL24045690W,The witches--The graphic novel,"Pénélope Bagieu, Roald Dahl",2020.0,,"eng, spa",,,13152043.0
graphic novel,/works/OL19086822W,Monster High,Heather Nuhfer,2014.0,,eng,,,8402740.0
graphic novel,/works/OL21838060W,Long Way Down,Jason Reynolds,2017.0,,eng,,,10493501.0
graphic novel,/works/OL85892W,Dracula,Bram Stoker,1897.0,,"alb, spa, tur, eng, gle",,,12216503.0
graphic novel,/works/OL17075811W,Sapiens,Yuval Noah Harari,2011.0,,"rum, tur, kor, eng, ger",,,8634250.0
graphic novel,/works/OL8400840W,Yu-Gi-Oh!,Kazuki Takahashi,1997.0,,"chi, eng",,,863639.0
graphic novel,/works/OL21177W,Wuthering Heights,Emily Brontë,1846.0,,"rus, arm, ita, fre, eng",,,12818862.0
graphic novel,/works/OL2772007W,The Yellow Wallpaper,"Charlotte Perkins Gilman, Aric Cushing, Logan Thomas, SparkNotes, Bryan Hunt, A. J. Alexander, Steven Stern, Aileen Oracion, Twisted Classics, Anne Geer, Sara Barkat, Period Time Publishing, Félix Gerónimo, AGUSTIN LOPEZ TOBAJAS, Nicolae Sfetcu, Erminia Passannanti",1892.0,,"spa, eng, ita, fre, ger",,,652029.0
graphic novel,/works/OL3140822W,To Kill a Mockingbird,Harper Lee,1960.0,,"eng, fre, urd, spa, swe",,,14351077.0
graphic novel,/works/OL510405W,Ringworld,Larry Niven,1970.0,,"spa, fre, ger, eng",,,8999878.0
graphic novel,/works/OL66554W,Pride and Prejudice,Jane Austen,1813.0,,"hun, swe, rus, ita, cze",,,14348537.0
graphic novel,/works/OL468431W,The Great Gatsby,F. Scott Fitzgerald,1920.0,,"ind, fre, ita, kor, eng",,,10590366.0
graphic novel,/works/OL1168007W,Animal Farm,George Orwell,1945.0,,"hun, swe, rus, ita, fre",,,11261770.0
graphic novel,/works/OL52267W,The Time Machine,H. G. Wells,1895.0,,"tam, eng, ger, epo, chi",,,9009316.0
graphic novel,/works/OL20844W,The Red Badge of Courage,Stephen Crane,1855.0,,"eng, kor, spa, rus, chi",,,8236915.0
graphic novel,/works/OL2775807W,Pollyanna,"Eleanor Hodgman Porter, Porter, Neil Reed, Lee Giles",1912.0,,"eng, jpn, tur, pol, rus",,,902113.0
graphic novel,/works/OL66562W,Sense and Sensibility,Jane Austen,1811.0,,"hun, heb, chi, rus, kor",,,9278292.0
graphic novel,/works/OL19717199W,Scorpia,"Anthony Horowitz, Antony Johnston",2015.0,,eng,,,10546963.0
graphic novel,/works/OL24034W,Treasure Island,Robert Louis Stevenson,1880.0,,"rus, ita, sco, fre, eng",,,13859660.0
graphic novel,/works/OL1099513W,Voyage au Centre de la Terre,Jules Verne,1867.0,,"fre, chi, mac, cze, por",,,5890987.0
graphic novel,/works/OL262438W,The Sign of Four,Arthur Conan Doyle,1889.0,,"fin, spa, eng, mul, srp",,,9247987.0
graphic novel,/works/OL20456365W,The last Olympian,"Robert Venditti, Orpheus Collar, Rick Riordan",2019.0,,eng,,,9121923.0
graphic novel,/works/OL267171W,War and Peace,Лев Толстой,1864.0,,"hun, und, chi, tur, rus",,,12621906.0
graphic novel,/works/OL21629205W,Mortal Instruments,"Cassandra Clare, Cassandra Jean",2017.0,,eng,,,10514662.0
graphic novel,/works/OL34276643W,The Mark of Athena Graphic Novel,Robert Venditti,2023.0,,eng,,,13298787.0
graphic novel,/works/OL381550W,The Island of Dr. Moreau,H. G. Wells,1896.0,,"und, chi, ger, ita, fre",,,968312.0
graphic novel,/works/OL28062403W,Five Nights at Freddy's,"Scott Cawthon, Andrea Waggener, Carly Anne West, Christopher Hastings, Didi Esmeralda",2023.0,,eng,,,13297330.0
graphic novel,/works/OL81773W,Dinosaurs Before Dark,Mary Pope Osborne,1992.0,,"eng, ara, pol, ger, spa",,,14390457.0
graphic novel,/works/OL29983W,Little Women,Louisa May Alcott,1848.0,,"gle, urd, und, chi, rus",,,8775559.0
graphic novel,/works/OL166894W,Преступление и наказание,Фёдор Михайлович Достоевский,1866.0,,"rus, cze, ita, fre, eng",,,9411873.0
graphic novel,/works/OL455305W,The Scarlet Letter,Nathaniel Hawthorne,1800.0,,"rus, ita, afr, cze, bul",,,5654516.0
graphic novel,/works/OL1095427W,Jane Eyre,Charlotte Brontë,1847.0,,"sot, eng, cor, ita, und",,,8235363.0
graphic novel,/works/OL27482W,The Hobbit,J.R.R. Tolkien,1937.0,,"swe, rus, ita, cze, bul",,,14627509.0
graphic novel,/works/OL8193416W,The Picture of Dorian Gray,Oscar Wilde,1890.0,,"ita, dut, arm, fre, fin",,,14314858.0
graphic novel,/works/OL30053233W,Create Your Own Graphic Novel - Deluxe Edition,Graphic Novel Designs,2019.0,,eng,,,13181036.0
graphic novel,/works/OL114967W,The Jungle,Upton Sinclair,1707.0,,"dan, ita, eng, swe, lit",,,8231790.0
graphic novel,/works/OL77746W,Anne of Green Gables,Lucy Maud Montgomery,1908.0,,"fre, spa, kor, jpn, dut",,,14641084.0
graphic novel,/works/OL450063W,Frankenstein or The Modern Prometheus,Mary Shelley,1818.0,,"chi, rus, ita, dut, fre",,,12356249.0
graphic novel,/works/OL27294003W,Bunnicula The Graphic Novel,"James Howe, Andrew Donkin, Stephen Gilpin",2022.0,,eng,,,12879037.0
graphic novel,/works/OL77958W,The Last of the Mohicans,James Fenimore Cooper,1826.0,,"eng, ita, dan, fre, pol",,,8236937.0
graphic novel,/works/OL318900W,The Prophet,"Kahlil Gibran, R. Black",1900.0,,"heb, chi, kor, tur, arm",,,418324.0
graphic novel,/works/OL471932W,The Murder of Roger Ackroyd,Agatha Christie,1926.0,,"dut, eng, epo, ita, hrv",,,13151356.0
graphic novel,/works/OL462007W,Peter Pan,J. M. Barrie,1911.0,,"und, chi, gsw, ita, spa",,,8237052.0
graphic novel,/works/OL38663W,Heart of Darkness,Joseph Conrad,1899.0,,"spa, tur, eng, mul, chi",,,12307847.0
graphic novel,/works/OL8721462W,Great Expectations,Charles Dickens,1861.0,,"amh, srp, und, hun, heb",,,13322313.0
graphic novel,/works/OL8193465W,A Tale of Two Cities,Charles Dickens,1800.0,,"swe, rus, ita, fre, eng",,,13301713.0
graphic novel,/works/OL30053009W,Du côté de chez Swann,Marcel Proust,1908.0,,"eng, ger, hun, por, ita",,,11967344.0
graphic novel,/works/OL52114W,The War of the Worlds,H. G. Wells,0.0,,"eng, ger, dan, chi, ita",,,36314.0
graphic novel,/works/OL14942956W,The Call of the Wild,Jack London,1903.0,,"gle, alb, swe, heb, chi",,,12393037.0
graphic novel,/works/OL472073W,Murder on the Links,Agatha Christie,1923.0,,"chi, ita, spa, pol, por",,,14582832.0
graphic novel,/works/OL262454W,The Hound of the Baskervilles,Arthur Conan Doyle,1900.0,,"ita, cze, fre, eng, fin",,,8063264.0
graphic novel,/works/OL44927W,Tess of the d'Urbervilles,Thomas Hardy,1707.0,,"und, swe, rus, chi, cze",,,13109386.0
graphic novel,/works/OL262496W,A Study in Scarlet,Arthur Conan Doyle,1887.0,,"fin, eng, ger, chi, por",,,13405534.0
graphic novel,/works/OL362699W,The Tempest,William Shakespeare,1611.0,,"swe, enm, ita, fre, eng",,,8155661.0
graphic novel,/works/OL98501W,Ethan Frome,Edith Wharton,1910.0,,"spa, kor, eng, chi, ita",,,8303480.0
graphic novel,/works/OL258902W,Macbeth,William Shakespeare,1508.0,,"swe, geo, enm, rus, arm",,,872432.0
graphic novel,/works/OL5738586W,Rapunzel's Revenge,"Shannon Hale, Nathan Hale, Dean Hale",2008.0,,eng,,,7093418.0
graphic novel,/works/OL1140109W,The Good Earth,Pearl S. Buck,1931.0,,"mar, und, chi, kor, ita",,,2626823.0
graphic novel,/works/OL14869167W,The Old Curiosity Shop,Charles Dickens,1800.0,,"heb, chi, ger, ita, spa",,,13119794.0
graphic novel,/works/OL102749W,Moby Dick,Herman Melville,1851.0,,"swe, rus, ita, fre, eng",,,10544254.0
graphic novel,/works/OL2021953W,Robin Hood,Howard Pyle,1883.0,,"tur, spa, fre, eng, rum",,,5913135.0
graphic novel,/works/OL8127201W,The King in Yellow,Robert W. Chambers,1895.0,,"ger, eng, spa",,,4752788.0
graphic novel,/works/OL27776452W,The Importance of Being Earnest,Oscar Wilde,1893.0,,"eng, spa, fre, ger",,,1260453.0
graphic novel,/works/OL8193478W,Oliver Twist,Charles Dickens,1822.0,,"rus, ita, fre, eng, hrv",,,13300802.0
graphic novel,/works/OL24156W,The Strange Case of Dr. Jekyll and Mr. Hyde,Robert Louis Stevenson,1875.0,,"fre, jpn, chi, yid, rus",,,295773.0
graphic novel,/works/OL362702W,Julius Caesar,William Shakespeare,1656.0,,"rus, aka, ita, afr, mlt",,,7901303.0
graphic novel,/works/OL259010W,A Midsummer Night's Dream,William Shakespeare,1600.0,,"fin, dan, chi, und, rus",,,7205924.0
graphic novel,/works/OL244537W,The Art of War,"孙武, Stephen F. Kaufman, Lionel Giles, Onésimo Colavidas",1900.0,,"chi, eng, cmn, ger, hin",,,4849549.0
graphic novel,/works/OL53919W,The Adventures of Tom Sawyer,Mark Twain,1817.0,,"chi, eng, ger, jpn, cze",,,12043351.0
graphic novel,/works/OL32466W,A Christmas Carol,"Charles Dickens, Groth, Nancy Baker",1843.0,,"fin, glg, chi, und, rus",,,12875748.0
graphic novel,/works/OL18396W,The Marvelous Land of Oz,L. Frank Baum,1904.0,,"heb, alb, eng, rus, ara",,,12648656.0
graphic novel,/works/OL1846076W,The Giver,Lois Lowry,1993.0,,"ita, spa, pol, fre, cat",,,8352502.0
graphic novel,/works/OL18417W,The Wonderful Wizard of Oz,L. Frank Baum,1899.0,,"aze, arm, dan, lat, chi",,,552443.0
graphic novel,/works/OL361466W,King Henry V,William Shakespeare,1600.0,,"hun, chi, und, fre, ita",,,7420215.0
graphic novel,/works/OL23205W,The Grapes of Wrath,John Steinbeck,1939.0,,"gre, chi, und, heb, jpn",,,12715902.0
graphic novel,/works/OL1099280W,Vingt mille lieues sous les mers,Jules Verne,1870.0,,"guj, hun, chi, rus, vie",,,6573517.0
graphic novel,/works/OL18412W,Dorothy and the Wizard in Oz,L. Frank Baum,1908.0,,"spa, eng, pol",,,12648659.0
graphic novel,/works/OL20600W,Gulliver's Travels,Jonathan Swift,1726.0,,"rum, mal, kor, ita, spa",,,12717083.0
graphic novel,/works/OL362427W,Romeo and Juliet,William Shakespeare,1597.0,,"gre, fin, hun, chi, dan",,,8257991.0
graphic novel,/works/OL9170454W,Hamlet,William Shakespeare,1603.0,,"fry, gre, fin, hun, chi",,,8281954.0
graphic novel,/works/OL52266W,The Invisible Man,H. G. Wells,0.0,,"mon, chi, rus, fre, ita",,,6419199.0
graphic novel,/works/OL1793164W,Three Men in a Boat (to say nothing of the dog),Jerome Klapka Jérôme,1889.0,,"ita, dut, spa, fre, cat",,,8243006.0
graphic novel,/works/OL675783W,The Handmaid's Tale,Margaret Atwood,1985.0,,"dan, chi, eng, ger, jpn",,,8231851.0
graphic novel,/works/OL45089W,Robinson Crusoe,"Daniel Defoe, J. J. Grandville, Petrus Borel, Les éditions du Rey, N. C. Wyeth",1686.0,,"fin, chi, und, rus, yid",,,368541.0
graphic novel,/works/OL36737329W,Winter Turning - Graphic Novel,Tui T. Sutherland,2015.0,,eng,,,14554663.0
graphic novel,/works/OL1089297W,The Prince,Niccolò Machiavelli,1515.0,,"tam, chi, rus, jpn, swe",,,12726168.0
graphic novel,/works/OL796465W,O Alquimista,Paulo Coelho,1988.0,,"gre, chi, dan, rus, eng",,,7414780.0
graphic novel,/works/OL63985W,The Legend of Sleepy Hollow,Washington Irving,1820.0,,"epo, per, lav, gre, hun",,,8243083.0
graphic novel,/works/OL471832W,Hallowe'en Party,Agatha Christie,1969.0,,"ita, dut, spa, pol, fre",,,11160095.0
graphic novel,/works/OL471895W,The Murder at the Vicarage,Agatha Christie,1930.0,,"por, ger, eng, rus, fre",,,12996560.0
graphic novel,/works/OL15854658W,Black Beauty,Anna Sewell,1877.0,,"fre, eng, wel, ger",,,5007492.0
graphic novel,/works/OL259026W,King Lear,William Shakespeare,1608.0,,"gre, fin, geo, hun, chi",,,7420452.0
graphic novel,/works/OL471576W,Murder on the Orient Express,Agatha Christie,1933.0,,"jpn, hun, chi, rus, vie",,,11100465.0
graphic novel,/works/OL8699480W,Cipher,Minako Narita,2005.0,,eng,,,2737769.0
graphic novel,/works/OL93227W,Inferno,Dante Alighieri,1767.0,,"ita, spa, fre, eng, per",,,6387077.0
graphic novel,/works/OL863808W,Ivanhoe,Sir Walter Scott,1800.0,,"gle, dut, spa, fre, rus",,,314235.0
graphic novel,/works/OL1100007W,Le Tour du Monde en Quatre-Vingts Jours,Jules Verne,1872.0,,"gle, guj, kor, ita, fre",,,6976035.0
graphic novel,/works/OL8483260W,Diary of a Wimpy Kid,Jeff Kinney,2007.0,,"glg, chi, dan, mao, baq",,,14376136.0
graphic novel,/works/OL17321978W,Through the Woods,Emily Carroll,2014.0,,eng,,,7401054.0
graphic novel,/works/OL20523948W,The mortal instruments,"Cassandra Clare, Cassandra Jean",2017.0,,eng,,,9174695.0
graphic novel,/works/OL40372974W,Blank Graphic Novel Book : 99 Pages for Your Idea,Graphic Novel Studios,2016.0,,eng,,,
graphic novel,/works/OL471713W,Dead Man's Folly,Agatha Christie,1956.0,,"eng, ger, chi, fre, spa",,,6985969.0
graphic novel,/works/OL453697W,Small Gods,"Terry Pratchett, Ray Friesen",1992.0,,"eng, rus, ger, fre, cze",,,14648232.0
graphic novel,/works/OL679358W,Coraline,Neil Gaiman,2001.0,,"pol, ita, fre, eng, baq",,,14171421.0
graphic novel,/works/OL28400383W,Squished,"Megan Wagner Lloyd, Michelle Mee Nutter",2023.0,,eng,,,13268437.0
graphic novel,/works/OL5850282W,Be more chill,Ned Vizzini,2004.0,,"fre, eng, heb",,,544275.0
graphic novel,/works/OL25446651W,Ghosts,Raina Telgemeier,2016.0,,eng,,,12401501.0
graphic novel,/works/OL29214675W,FGTeeV Graphic Novel #4,"FGTeeV, Miguel Díaz Rivas",2023.0,,eng,,,14028657.0
graphic novel,/works/OL5725956W,Artemis Fowl,Eoin Colfer,1999.0,,"por, heb, ger, eng, rus",,,10212689.0
graphic novel,/works/OL278279W,Playback,Raymond Chandler,1958.0,,"eng, spa, ger, fre",,,94549.0
graphic novel,/works/OL276287W,Graphic Novels,Paul Gravett,2005.0,,eng,,,37109.0
graphic novel,/works/OL15729299W,I Survived Hurricane Katrina 2005,"Lauren Tarshis, Arnell Powell",2011.0,,eng,,,6747109.0
graphic novel,/works/OL17620025W,Kindred,"Octavia E. Butler, Damian Duffy, John Jennings, María Barbado Mujica",2017.0,,eng,,,7899091.0
graphic novel,/works/OL28836164W,Legend (Graphic Novel),Marie Lu,2015.0,,,,,
graphic novel,/works/OL465952W,Redwall,Brian Jacques,1986.0,,"fre, pol, ita, eng, spa",,,2325082.0
graphic novel,/works/OL1948670W,Five Go Adventuring Again,Enid Blyton,1943.0,,"por, eng, ger, spa",,,14601324.0
graphic novel,/works/OL8842598W,Amulet,Kazu Kibuishi,2008.0,,"eng, spa, fre",,,2420582.0
graphic novel,/works/OL679360W,American Gods,Neil Gaiman,2001.0,,"spa, fre, chi, eng, ger",,,8494659.0
graphic novel,/works/OL18316812W,The graphic novel,Jan Baetens,2001.0,,eng,,,2287489.0
graphic novel,/works/OL26278387W,Ark Angel The Graphic Novel,"Anthony Horowitz, Antony Johnston, Amrit Birdi",2019.0,,eng,,,12280845.0
graphic novel,/works/OL17504079W,Frankenstein,"Jason Cobley, Mary Shelley",2008.0,,eng,,,9319226.0
graphic novel,/works/OL72245W,Goosebumps - Creepy Creatures,"Robert Lawrence Stine, Sheila Keenan, Scott Morse, Greg Ruth",2006.0,,eng,,,279487.0
graphic novel,/works/OL31858591W,Graphic Novel (Graphic Novel RID),,,,,,,
graphic novel,/works/OL22007810W,My Graphic Novel,"Comic Book Queen, Comic Book Queen",2020.0,,eng,,,
graphic novel,/works/OL5762061W,Corridor: A Graphic Novel,Sarnath Banerjee,2005.0,,eng,,,111034.0
graphic novel,/works/OL1915012W,The Hiding Place,"Corrie ten Boom, Elizabeth Sherrill, John Sherrill, John Scherrill, Jill De Haan, Daniel Strange",1971.0,,eng,,,12817925.0
graphic novel,/works/OL453735W,Guards! Guards!,Terry Pratchett,1989.0,,"dut, ita, spa, fre, rus",,,13095550.0
graphic novel,/works/OL21907375W,Wolfwalkers,Samuel Sattin,2020.0,,eng,,,10522999.0
graphic novel,/works/OL42711429W,The Prophecies Begin #1,Erin Hunter,2024.0,,eng,,,14638606.0
graphic novel,/works/OL28959223W,"Heartstopper, Volume Five",Alice Oseman,2021.0,,"eng, dut, pol",,,13273878.0
graphic novel,/works/OL14912640W,Dragonflight Graphic Novel,Anne McCaffrey,1993.0,,eng,,,11408820.0
graphic novel,/works/OL20919671W,Twins,"Varian Johnson, Shannon Wright",2020.0,,eng,,,10289795.0
graphic novel,/works/OL28019124W,Pokemon,Pokemon,2023.0,,eng,,,13134488.0
graphic novel,/works/OL20010806W,The Throne of Fire,Orpheus Collar,2015.0,,"eng, spa",,,11960138.0
graphic novel,/works/OL19668202W,The son of Neptune,Robert Venditti,2016.0,,eng,,,13216542.0
graphic novel,/works/OL25131860W,The Subtle Knife Graphic Novel,"Philip Pullman, Thomas Gilbert, Stéphane Melchior",2022.0,,eng,,,11973643.0
graphic novel,/works/OL16806686W,The Phoenix Project,"Gene Kim, Kevin Behr, George Spafford, Gene Kim",2013.0,,eng,,,9151976.0
graphic novel,/works/OL15729416W,Skeleton Key,"Anthony Horowitz, Antony Johnston, Kanako Damerum, Yuzuru Takasaki",2009.0,,eng,,,6747161.0
graphic novel,/works/OL20011852W,Monster,Guy A. Sims,2015.0,,eng,,,11883092.0
graphic novel,/works/OL25691830W,Graphic Novel,"Jan Baetens, Hugo Frey",2014.0,,eng,,,
graphic novel,/works/OL38121567W,Dog Man,Dav Pilkey,2024.0,,eng,,,14750336.0
graphic novel,/works/OL4357801W,Transformers,"Simon Furman, Chris Ryall, Don Figueroa, E.J. Su",2003.0,,eng,,,896711.0
graphic novel,/works/OL8117954W,Mary Anne Saves the Day,Raina Telgemeier,2007.0,,eng,,,1230252.0
graphic novel,/works/OL32477896W,Graphic Novel Classics,Bram Stoker,2014.0,,eng,,,13226681.0
graphic novel,/works/OL19354663W,Cardboard,Doug TenNapel,2012.0,,eng,,,8468501.0
graphic novel,/works/OL17458915W,"Twilight. The Graphic Novel, Volume 2",Young Kim,2011.0,,eng,,,7620060.0
graphic novel,/works/OL1190289W,À la recherche du temps perdu,Marcel Proust,1919.0,,"ita, fre, jpn, rus, chi",,,12332709.0
graphic novel,/works/OL8488892W,Vampire Academy,"Richelle Mead, Richelle Mead",2007.0,,eng,,,10136600.0
graphic novel,/works/OL43395757W,Graphic novel,Kurt Bracharz,2016.0,,eng,,,
graphic novel,/works/OL38379007W,Issunboshi : a Graphic Novel,Ryan Lang,2024.0,,eng,,,
graphic novel,/works/OL5682519W,Dog Days,Jeff Kinney,2007.0,,"baq, pol, ger, bul, chi",,,12366143.0
graphic novel,/works/OL19932592W,Silverwing,Kenneth Oppel,2022.0,,eng,,,14564415.0
graphic novel,/works/OL15049906W,Thumbelina,"Hans Christian Andersen, Elsa Beskow, Michael Foreman, Michael Morpurgo, Kimberley Reynolds, Catherine Babok, Susannah Mary Paull",1911.0,,"gla, fre, ger, chi, urd",,,1357775.0
graphic novel,/works/OL24350805W,Diary of an 8-Bit Warrior Graphic Novel,"Pirate Sourcil, Odone, Jez",2021.0,,eng,,,10875830.0
graphic novel,/works/OL19740915W,Illegal,"Eoin Colfer, Andrew Donkin",2017.0,,"eng, spa",,,8732881.0
graphic novel,/works/OL19719464W,Anne of Green Gables,Mariah Marsden,2017.0,,eng,,,10228555.0
graphic novel,/works/OL19965691W,"New Moon - The Graphic Novel, Vol. 1",Young Kim,2013.0,,eng,,,11022931.0
graphic novel,/works/OL20051765W,Musnet,Kickily Graphic novel creator,2016.0,,eng,,,13058276.0
graphic novel,/works/OL17406601W,My Friend Dahmer,"Derf Backderf, Derf Backderf",2012.0,,eng,,,14388898.0
graphic novel,/works/OL73387W,Dragonflight,Anne McCaffrey,1968.0,,"heb, ger, eng, fre, spa",,,10306696.0
graphic novel,/works/OL453658W,Mort,Terry Pratchett,1987.0,,"eng, rus, ger, fre, cze",,,14648805.0
graphic novel,/works/OL17050148W,Seconds,Bryan Lee O'Malley,2001.0,,"eng, por, fre",,,8993851.0
graphic novel,/works/OL37864981W,First Test Graphic Novel : (a Graphic Novel),"Tamora Pierce, Becca Farrow",2024.0,,eng,,,14640749.0
graphic novel,/works/OL66218W,Wicked,Gregory Maguire,1995.0,,"eng, spa, chi, dut, kor",,,38706.0
graphic novel,/works/OL20033154W,Hollow City [graphic novel adaptation],"Ransom Riggs, Cassandra Jean",2016.0,,eng,,,15055208.0
graphic novel,/works/OL27845396W,Active Minds Graphic Novels,"Cassie Gitkin, Miller, Michael S.",2021.0,,eng,,,14650636.0
graphic novel,/works/OL44556116W,Graphic Novels : Schwerpunkt/ Focus,Friederike Eigler,2025.0,,ger,,,
graphic novel,/works/OL27844909W,Active Minds Graphic Novel,"Cassie Gitkin, Miller, Michael S.",2021.0,,eng,,,14650635.0
graphic novel,/works/OL32466151W,Graphic Novel Classics,Mary Shelley,2014.0,,eng,,,
graphic novel,/works/OL6036126W,The 101 Best Graphic Novels,Stephen Weiner,2001.0,,eng,,,793616.0
graphic novel,/works/OL17880230W,Graphic Novels,Ashley Rae Harris,2013.0,,eng,,,8189705.0
graphic novel,/works/OL20051766W,Musnet,Kickliy (Graphic novel creator),2016.0,,eng,,,13047242.0
graphic novel,/works/OL20757418W,Jake Maddox Graphic Novels,"Jake Maddox, Tina Francisco, Eduardo Garcia, Mel Joy San Juan, Berenice Muniz",2017.0,,eng,,,13278874.0
graphic novel,/works/OL25957597W,Invisible,"Christina Diaz Gonzalez, Gabriela Epstein",2022.0,,eng,,,12961663.0
graphic novel,/works/OL18409W,The Emerald City of Oz,L. Frank Baum,1910.0,,eng,,,1473556.0
graphic novel,/works/OL36014549W,Graphic Novel,Mike Chinn,2004.0,,eng,,,
graphic novel,/works/OL38255804W,Graphic Novel/Comic,Poor art student,2016.0,,eng,,,
graphic novel,/works/OL23745689W,1984,"George Orwell, Fido Nesti",1984.0,,"cze, eng",,,10502178.0
graphic novel,/works/OL32455094W,The Rolling Stones en BD,Céka (Graphic novel author),2017.0,,fre,,,
graphic novel,/works/OL25474480W,Spy School the Graphic Novel,"Stuart Gibbs, Anjan Sarkar",2022.0,,eng,,,13760702.0
graphic novel,/works/OL17600756W,Snow White,Matt Phelan,2016.0,,eng,,,7886607.0
graphic novel,/works/OL34200928W,Hide,"Kiersten White, Scott Peterson, Veronica Fish, Andy Fish",2023.0,,eng,,,13561083.0
graphic novel,/works/OL18800016W,The rough guide to graphic novels,Danny Fingeroth,2008.0,,eng,,,11707770.0
graphic novel,/works/OL36846666W,Goddess Girls Graphic Novel Legendary Collection,"Joan Holub, Suzanne Williams, David Campiti, Glass House Glass House Graphics",2023.0,,eng,,,
graphic novel,/works/OL38682643W,Disney Classic Graphic Novel,The Disney The Disney Comics Group,2024.0,,eng,,,
graphic novel,/works/OL35623W,Parable of the Sower,Octavia E. Butler,1993.0,,"spa, eng, ger, fre",,,10466266.0
graphic novel,/works/OL2056818W,Maus I,Art Spiegelman,1986.0,,"fre, pol, ita, cat, eng",,,10210168.0
graphic novel,/works/OL16025215W,Novels (Adventures of Huckleberry Finn / Adventures of Tom Sawyer),Mark Twain,1922.0,,"chi, rus, eng, ger, lit",,,12374727.0
graphic novel,/works/OL28840815W,"Great Gatsby, a Graphic Novel","Pete Katz, F. Scott Fitzgerald",2020.0,,eng,,,13725056.0
graphic novel,/works/OL30500504W,"Ninja Comic Book, Graphic Novel",Comic Book Queen,2020.0,,eng,,,
graphic novel,/works/OL21348214W,Act (graphic Novel),Kayla Miller,2020.0,,eng,,,12983849.0
graphic novel,/works/OL19958217W,Zoo,Andy MacDonald,2012.0,,eng,,,10384125.0
graphic novel,/works/OL267622W,Astérix le Gaulois,"René Goscinny, Albert Uderzo",1961.0,,"gem, fre, pol, ita, gla",,,962725.0
graphic novel,/works/OL15378406W,The Exile,Diana Gabaldon,2010.0,,eng,,,6593868.0
graphic novel,/works/OL20158338W,"New Moon - The Graphic Novel, Vol. 2",Stephenie Meyer,2016.0,,eng,,,8803417.0
graphic novel,/works/OL20479740W,Graphic Novels,Andrew Dale,2016.0,,eng,,,9144343.0
graphic novel,/works/OL17414237W,Great Expectations The Elt Graphic Novel,"Brigit Viney, Jen Green, Jenny Placentino, Clive Bryant, John Stokes, Jim Campbell, Jason Cardy, Jo Wheeler",2009.0,,eng,,,7531127.0
